id,date,username,stars,variation,badge,upvotes,comments,title,body
RY11929L02OAT,"October 3, 2019",Orestes,1,N/A,Verified Purchase,15,2,Defective out of the box - poor warranty support,"This particular printer was defective when delivered. As soon as it was set up it was obvious that the print quality was very poor. After contacting Lexmark and sending examples and details (SN, proof of purchase etc) of the printer, the initial diagnosis was a faulty toner cartridge. A new toner cartridge was promised for delivery the next day. Three days later, after multiple follow ups, I received notice that it had finally shipped. That turned out to not be the problem. Further diagnosis led to a conclusion that the problem was deeper and that the unit would need additional parts replaced. Rather than simply replacing the defective printer with a new one and an apology, I was told the necessary parts would be shipped overnight and a technician would be organized to install them and ensure that the printer was fully repaired. A week later, no parts, no technician, no contact from Lexmark, and still no working printer. Returned via Amazon. Very disappointing experience. Its possible that if you happen to get a working printer, it might serve you well. But don't count on much in the way of support from Lexmark if you happen to get a dud."
R1LVMAR6YBYF7X,"July 23, 2019",Doc H,4,N/A,Vine Customer,31,0,An Excellent Home/Small Business Laser Printer,"As a preface, Lexmark, the company, got out of the inkjet printer business in 2012. They were known for making fairly decent inkjets, with expensive proprietary ink (a business model Lexmark pioneered), complicated to set up and not always user friendly. There were also a series of complicated acquisitions and mergers following, with the resulting Lexmark of today. Now exclusively manufacturing laser printers in that product line, it is reassuring to note that not all of their inkjet reputation has followed them.This particular laser printer (MC3224adwe) is a reasonably good example of their product line. I set it up on a PC with a 64-bit Windows 10 OS – so to clarify, MAC users may have a different experience. Setup was fairly straightforward, with the exception of some hiccups with the mobile app setup (which the printer screen pops up and suggests) – as in it never connected to the network. I was able to connect with a USB cable, and subsequently to the network through the printer interface however, and the connection was solid and stable. My home network is a Linksys mesh, with about 50 connected devices and a 4T server, and so far no conflicts. The printer is configurable through the onboard screen interface as well as the Lexmark software (which actually follows my historical Lexmark experience – no frills, basic software, with not a lot of graphic flash and user prompts). Don’t count on a print preview with this software either, outside the Windows Print interface – your document will print as soon as the printer spools up, which actually takes a little more time than an inkjet. Multiple settings can be controlled and somewhat adjusted on the fly (like changing from 1 to 2-sided printing), although you may need to scroll through multiple menu screens to get what you want.As far as the printer hardware, the unit itself is pretty hefty – just over 40 pounds – but not much bigger than the Epson 4740 space it now occupies – maybe a shade deeper and taller. Laser printers have come a long way from back in the day they needed their own – large – cart. It does not have a telephone bypass, so if you fax a lot you will need a dedicated line, although in a pinch you can use a cable splitter and connect to your landline paired with your phone. The bad news is there is nothing in the software that let’s the printer detect an incoming call distinct from a fax, so if you're used to having your fax printer connected to your single phone line, and only pick up when a fax comes in (as many inkjet small business printers accommodate), you're out of luck. The solution is to temporarily turn off the analog fax, then turn it on when you need it, but again, several menu screens to accomplish. There is actually a marked space for a bypass (an “out"" connection for a phone cable), but it’s covered by a metal plate - so I assume it may be possible to add it later. As a dedicated fax it works well.The other, minor, quirk, is the paper feed bin, which is an ungenerous 250-sheet tray, mysteriously unlabeled, although the manual feed tray just above it is printed with the number “1.” The larger paper bin is, in fact, “Tray 1” when you sort out the defaults, but you wouldn't be able to tell from the instructions because there are none – just a couple of sheets of graphic images of the printer detailing stages of setup, sort of historical Lexmark hilarity. You can, after you figure it out, feed single sheets or envelopes manually through the single feed tray labeled “1.”The scanner function works through the onboard printer menu, and gives you a popup screen on your computer with basic scan functions using the Windows Fax and Scan utility– and you can scan to file, print, fax or email – from the document feeder or flatbed. It does allow you to scan in a variety of formats, but, being Windows, not directly to a PDF. Printing itself is fairly straightforward as well, and it's actually very easy to print directly from a mobile device, phone or tablet, without going through a dozen servers – kudos. The rated output is 24ppm, and that’s probably pretty accurate; 2-sided printing is the default, but configurable to 1 or 2, and it does it very well. That's slightly faster than a similarly configured business inkjet printer, and you can get this printer identically configured to print 26ppm as the MC3326 (more expensive). It's not apparent from the description, but it doesn't do straight duplex (2-sided) copies, but the more complicated copy each side, then combine. Print quality is good, but benefited by using laser paper – one of the true advantages of an inkjet is that it will print equally well on just about any thickness or texture of paper – don’t try that with a laser, but the strength of a laser is that it will print crisp text down to the tiniest font on the right paper. Color photos are also not a strength of laser printers, so if you are a dedicated photographer this is not your go-to, but it does a decent job of printing color photos up to about a 4800 cq (about 2400x600 dpi) resolution and 8x10, and particularly on glossy laser paper, with a good default color balance.And then there's the cost. Energy-wise, an inkjet or a laser printer use a negligible amount of electricity, because they essentially shut down after use. Expendable ink supplies are another matter. The toner cartridges for this printer cost almost $100 each, and it requires four. A full replacement set costs more than the printer, retail (though not unlike a comparable inkjet comparison). Lexmark does have an eco-friendly (and budget-friendly) exchange program for toner, which saves about 25% off that, although it doesn't seem to be currently available for this printer – maybe later. Compared to about $40 retail for inkjet replacement cartridges (and you also need four) for the Epson 4740 Workforce, an equivalent home/small business inkjet printer. This would seem to be quite a disparity, until you factor in the cost per print. The inkjet cartridges are rated over 600 pages each (sometimes more), but if you've used an inkjet, you know you’re unlikely to get the rated output. Inkjet ink dries out, requiring the printer to cycle and clean the heads periodically. You'll likely need to manually clean them at least once through the life of a cartridge, maybe more, especially with infrequent use. And probably realign the heads, also using ink. So don't count on the rated pages for an inkjet cartridge – 50 to 75 percent is more realistic. A laser toner cartridge will literally last years, in or out of the printer, used or unused, and the cartridges for this printer are rated at 1,500 pages (the standard, not the included cartridges - about half that), and you will get the full number of rated pages. A caveat for both – pages for rating estimates are considered mixed text and graphics – not full photographic spreads, which will reduce rated output.So the summary is that the available laser cartridges for the Lexmark will produce likely about two or three times as many pages as the equivalent inkjet, for a slightly better cost per page, and better printed text, with the added benefit of not fiddling with head alignment or cleaning, and not worrying about leaving the cartridges in the printer for an extended period. If you are a small business with basic printing, copying and faxing needs, or a home user who prints occasionally, faxes occasionally, copies and scans occasionally, and doesn't require high-def photos, this is a solid, economical laser printer that will serve you as well or better than an inkjet. If you are a photographer who needs maximum resolution prints larger than 8x10, or routinely uses graphic arts paper, take a look at a modern dedicated inkjet, knowing you will spend more in life-cycle costs to get what you want. For most of us, the Lexmark is probably what we should have on our desk. Recommended."
R218MLO8BAOX78,"November 8, 2019",MH,1,N/A,Verified Purchase,5,0,THIS PRINTER IS NOT USER FRIENDLY.,"The only things positive about a Lexmark MC3224adwe printer was its print quality and its physical construction (51 lbs). The printer was delivered without written support to setup this printer. Lexmark's online information is essentially meaningless. It was not only hard to understand, but it was vastly incomplete and misleading. After spending over 10 hours on the telephone with Lexmark's 3rd party contractor/support team, the technician got the printer to print properly. The technician could not get the scanner to function with the Lexmark information supplied to the 3rd party support team. The scanner worked after being ""jerry rigged"" by the technician with a non Lexmark product. Whoever designed Lexmark's software did not seem know what they were doing. The printer is built like a tank with the brain of a worm. I finally gave up and returned the printer to Amazon."
R3ADV8URCH0W7Q,"August 24, 2019",Chef Dude...,5,N/A,Verified Purchase,8,0,Chef Dude...,"The smoothest, most user-friendly set up I have seen in the 3 printers I previously purchased. Toners are back ordered to purchase since this model only arrived in July but the Black toner is more available.The Mrs. is very pleased with the quality, as well. Very pleased!!!!"
RCWVYCEA8V2JZ,"November 9, 2019",Vizoere,4,N/A,Verified Purchase,1,0,"Good value, weak wifi, a bit complicated","I finally got it set up and working properly. I'm able to print from my two Windows-based computers and from my android phone. Document quality is superb, but photo quality is mediocre. I expected that when buying a laser, so no points off.I had several problems setting it up, most of which I think are due to a weak wifi radio. The printer is on the opposite end of the house from my router with walls, cabinets, a refrigerator between them. That said, other devices (phones, tablets, laptops, etc) work ok in this office.When turning on the printer for the first time, the screen showed a message telling me to go to a specific URL and download the Lexmark software for my mobile device to help set up the printer. I just went to the Google Play store and searched for Lexmark Mobile Assistant, and it came right up. Installed that and started the configuration. It seemed a bit complicated, but ended up working fine to configure the printer.Within the app, it suggested downloading the Lexmark printing app and the Lexmark print plugin. I did both and tried to print a picture from my phone. That's where the problems started. It would fail to connect, then connect ok long enough to send a print, then it couldn't connect anymore.I switched to setting up the Windows computers, downloaded the software from Lexmark (skipped using the CD, as they're usually out-of-date), and started the install. It couldn't locate the printer on the network, and after several tries using a couple of the options, I just clicked the Advanced button, typed in the IP address manually, and the install finished. Once that was finished, Windows could print and the printer spit out the paper with what I expected, but every time, I saw a message pop up that it couldn't connect to the printer.Eventually, after troubleshooting and searching Google, I decided to try plugging it in through an ethernet cable instead of worrying with wifi. After changing the Windows printer port to reflect the new IP address, I stopped getting the can't connect error. After deleting and re-adding the printer on my phone, it can now print as well.Overall, I'm happy with the printer, as it has the features I need for a reasonable price. As an IT person, I was able to work through the difficulties caused by the weak wifi radio, but I don't know that someone not familiar with networking would have been able to without assistance."
R2D8B8JW2E9QIA,"August 29, 2019",Tammy Minda,2,N/A,Verified Purchase,6,1,This printer is paper only not for cardstock.,This is a great paper printer but it does not print on cardstock. I was really disappointed.
R32V7NI6AHJEES,"December 12, 2019",D. Lebow,5,N/A,Verified Purchase,1,0,"Impressive printer, works great with macOS!","This is a really good little color laser multifunction printer. I’m on macOS and I was wary of a few negative reviews about the lack of Apple software for this unit, but I have a friend who is a Lexmark dealer and authorized repair center, so I thought it was worth the risk.It’s true that there is no Mac driver for this unit, but you don’t need it. Unpacking and setting up was easy… And using the free Lexmark iOS app to set up my Wi-Fi connection couldn’t have been simpler. My Mac Pro saw the printer instantly and I was up and running in two minutes.And while there is no Lexmark software to run this printer… I already owned VueScan, A third-party scanning software… And it runs this printer perfectly, including all of the options for resolution, flatbed scanning, document feeder scanning, and everything else. You can also access all of the printers options through your web browser by locating the printers address on your home network.So… Absolutely a joy to set up and use with my Mac Pro running Mojave."
RRHRTVHG3WNTH,"October 13, 2019",Hercules,3,N/A,Verified Purchase,3,1,Scan Challenges,The scan option is not on the menu screen - driver is loaded but not working from desktop or device. Cannot purchase the ink by single cartridge color . Don't see any option or details on returning the device as I am concerned with out the scan option I won't be able to keep it.
R1U86HZR3GFNLE,"September 11, 2019",Matt,1,N/A,Verified Purchase,6,2,Arrived defective,Product arrived defective. Continued to not recognize toner cartridges after protective covers removed. Purchase at your own risk.
R2O4J053TBM2XH,"November 11, 2019",Alan Ostlund,3,N/A,Verified Purchase,3,1,Lexmark scam,"I really like the printer, but I can't find out what toner cartridge it takes. The four that are installer have absolutely no numbers on them. My feelings are that this is their way of making sure I don't use aftermarket cartridges. If that is the case, it is the last Lexmark product I will ever buy. I may just put it up for sale when the cartridges are empty."
R369HGTT00BZAG,"January 22, 2020",WRX X,1,N/A,Verified Purchase,0,0,"Defective out of the box, support is almost non existent","i ordered this printer for home use. It was very inexpensive and with laser you don't really have to worry about cartridges drying out. After unpacking and removing the shipping protectors the printer kept complaining about shipping materials inside the cartridges. I kept looking for stuff to remove to no avail. I called support and i was told that this is a common problem with this printer, and they will rma it and send me a new one, and i will send this back. Well a week after the call the support rep keeps telling me that the tracking numbers will be available in 2 days. This has been going on for about a week now and no tracking numbers. I am ready to return this unit to amazon and be done with this brand. The only reason i got this is because it was very inexpensive, and with our usage the printer will be obsolete before the starter cartridges will be out."
R2XUGA1IDZ8BR5,"August 25, 2019",fred,1,N/A,Verified Purchase,4,1,Terrible,"I'm returning this unit. Every single time we try to print, it beeps & tells us to load paper. When it finally does print, the quality is fuzzy. We've tried adjusting the settings and have spent too much time trying to get it to function. Don't waste your time."
R3B49WX6C77PXX,"November 14, 2019",Ryan kiley,1,N/A,Verified Purchase,3,0,"Not very mac os friendly, wifi didn't work.",Printer would not stay connected via wifi. Called technical support twice. 1st time they were able to fix the issue after almost an hr long phone call. 2nd time they were unsuccessful and they acknowledged that this was a common problem that has yet to be resolved.I returned the printer and purchased a different model and brand altogether. Would not recommend.
R3GHPRRHJQJI29,"October 17, 2019",P. Gorman,3,N/A,Verified Purchase,1,0,difficult downloads,"tough time downloading instructions/ software from lexmark site. Eventually succeeded. Printer is noisy, but works OK as color printer/ copier. Still working on scan. Seems pretty good for the price. Not idiotproof, unfortunately."
R12PJBTAR767SP,"January 4, 2020",Cynthia Martinez,4,N/A,Verified Purchase,2,0,Ink cartridge,the printer is great the only down fall is the price on having to change out the ink cartridge. you're better off buying a new printer all over again because the ink cartridges are the same if not more costly than the printer itself.
R3KMHZL85GGGGT,"January 18, 2020",heatherg,1,N/A,Verified Purchase,0,1,Doesn't work for cardstock,"Having trouble printing on cardstock, which is what I bought it for. Ink is hard to get and incredibly expensive. I bought a black ink from BlueDogInk (Lexmark brand) and it says it's half-full but it's printing shadows on my pages and I have to take it out and shake it to get the streaks it's making to stop. Wish I'd never bought this."
RUGTJAGVHUW6C,"October 29, 2019",Jason,1,N/A,Verified Purchase,1,1,waste of money,Maybe worked for 10 pages. We were excited for it. Waited 3 weeks later to send off another print job. Can't print because I need to replace the waste bottle cartridge. I got 2 more days before I can submit a full refund and return. Piece of junk!
RFBKU5ZMTM9AE,"September 28, 2019",Mrs. S,5,N/A,Verified Purchase,1,0,Fantastic,Fantastic
R36FCV7L060JOX,"October 15, 2019",fosgood,4,N/A,Verified Purchase,0,0,So far so good,Touch screen is really small for entering fax numbers. Will probably have to buy a stylus and glue to the side. Called support to set up multi-page scanning to a single-doc and support did a remote session and programmed everything for us.
R3E5PJ124P1FU,"February 14, 2020",Marcelo Tettamanti,2,N/A,Verified Purchase,0,0,Tough to make it work with obsolete PC software,"Print quality is ok. Trying to scan was a nightmare. I've managed over 5 different multifunction printers and the software of this system is a nightmare. You don't even have a straight forward, single push, SCAN button in your main options. I keep getting lured by price and end up repenting on these second grade brands."
RSOO35603X5GM,"January 18, 2020",Kevin G,1,N/A,Verified Purchase,1,0,"Poor wi-fi, expensive and difficult to find toner cartridges.",Does not maintain wi-fi connection after power-down. Cannot find print cartridges locally. Does not maintain communication with computer through router. Very disappointed.
RH9FS1D2JXWF9,"January 7, 2020",Bradford D.,2,N/A,Verified Purchase,1,0,Keeps rebooting,The BIOS is unstable for some reason. Keeps rebooting.
R3UWJ09HIMIRUC,"January 20, 2020",DM,1,N/A,Verified Purchase,0,2,So Many Problems,"Everything that could possibly go wrong with this device does. Printer constantly drops offline, scanner works like 20% of the time. Constantly having to restart the device just to get it to work. And if you can even get it to print, the pages sometimes come out all black??? What a waste of toner. Touch screen is nice, though."
R3SNCWTGBBZO0L,"November 2, 2019",Wade N. Schneider,5,N/A,Verified Purchase,0,0,Great printer,I really like my new printer it prints quality color and black and white copies.
R4EPR22CU0QWU,"February 19, 2020",William A. Garlin Jr.,5,N/A,Verified Purchase,0,0,Nice Update,More compact than the unit it replaced and it does more.
R30HHEORE51BNN,"February 1, 2020",Joan & Marlin McGowin,4,N/A,Verified Purchase,0,0,Time will tell,So far so good for us.
RQASILPRCWWL2,"March 3, 2020",Amazon Customer,1,N/A,Verified Purchase,0,0,Not connecting wire,"Why is it not connecting with wireless connections, like a router, I have other printers from other companies but only this one is not connecting?"
R1UAOBFVNS67V5,"January 29, 2020",Cindy Jones,4,N/A,Verified Purchase,0,0,Welll,I pretty much like the printer but it seems to go off line a LOT
RV8PVU35QF29O,"July 22, 2019",Katherine Y,5,N/A,Vine Customer,6,0,"High-end printer with many features, may require on-line help with setup","The machine has all the features you could wish for in a higher-end printer. Both ethernet and wireless compatible, the technology allows you to set up the device according to your needs, even if you choose to print from your cellphone. You can scan, fax, and print. The color copies it makes are crisp and clear. At around 40 pounds, the printer can be moved if needed. It measures 13 inches high, 15 ½ inches wide, and 14 ½ inches deep, which makes it almost a square shape and capable of fitting in smaller spaces.A small control screen that is touch-enabled is located on the left front of the unit. The keypad that comes up is very touch-sensitive. I had to enter my long wireless information more than once in setting the printer up. The only negative I have encountered in using the printer is in the set-up. Instructions are clear and detailed for removing the clear tapes and plastic tabs, keeping the toner ink in place. You may need to chat online with a company representative as I did to ensure you have established connectivity to all your devices.You do have to download the printer driver which comes on a provided disc or from the given website. You will also need to enter your unique wireless information on your printer keypad if you are choosing this method. All in all, this was not a bad experience; the representative was very helpful and clear; however, the set-up process is not entirely intuitive.The printer functions beautifully. We have it connected to two laptops. I love its quiet operation and fast 24 pages per minutes printing speed."
