LXKresponded,body,codename,comments,date,id,model,program,purchaseType,reply,stars,title,upvotes,url,username
No,"3 Month Update: I have run low on toner and just discovered there is no aftermarket/generic toners available. I can buy Lexmark high yield toner package for $350 or standard yield for $275. I think I will throw this printer in the garbage and buy something new. I cannot afford toner that expensive, I had just assumed there is always an aftermarket of generic toners, but this printer must not sell in high enough numbers for aftermarket companies to make toners. It will be cheaper for me to throw this away and buy another brand printer that does have aftermarket toners available.Original Review: Home printers are throw away items. They usually don't last more a year, if they do, they need new rollers, drums, etc that cost more than a new printer. My Canon Imageclass MF634cdw was flawless for one year. Got it loaded and up and running in 20 minutes. After one year it started making awful grinding noises and printing badly, etc. Time for something new.This was only $114 and has the auto duplex function. It lacks the all-in-one document feeder and scanner, but I can still use that on my old Imageclass. Setup was difficult (much harder than my Canon was), and the printer could not be detected on my wifi, so I had to google how to load a print driver using an IP address. I've never done this before. Took me about 5 hours to set this printer up on my 2 computers (desktop & laptop), but it prints quickly and quietly. Auto duplex works perfect. After 5 days, it has not gone offline, not had any paper jams, no issues at all.I will update this if I have any issues, but after 5 days, despite some annoyances in getting it up and running, I am very please for only $114.",Bluering,0,"December 10, 2019",RVJ0L3I075N0B,C3224dw,Bluering/Lionfish (BRLF),Verified Purchase,,1,No Aftermarket Toner!!,6,https://www.amazon.com/gp/customer-reviews/RVJ0L3I075N0B?ie=UTF8&ASIN=B07T6PGM4J,E. Nelson
No,"Big printer! So far I really like it. Was easy to set up, and easy to print remotely from as devices.",Bluering,0,"January 12, 2020",R3IBKGGW7HZEN,C3224dw,Bluering/Lionfish (BRLF),Verified Purchase,,5,Easy set up,0,https://www.amazon.com/gp/customer-reviews/R3IBKGGW7HZEN?ie=UTF8&ASIN=B07T6PGM4J,Amazon Customer
No,"If your looking for a Mac printer / air print, this is not it. Although it does say air print right on the box, no matter what I did the printer would not connect. Manual IP entry, downloading drivers, even assigning the printer it’s own local port, nothing work on several air books. Returning ASAP",Bluering,0,"January 12, 2020",R13260TB0CSKD4,C3224dw,Bluering/Lionfish (BRLF),Verified Purchase,,1,MAC USERS BEWARE,1,https://www.amazon.com/gp/customer-reviews/R13260TB0CSKD4?ie=UTF8&ASIN=B07T6PGM4J,Brandon T.
No,"I WASTED HOURS TRYING TO GET THIS COMPUTER TO WORK WITH MY MAC. CUSTOMER SERVICE WAS LESS THAN USELESS (""Is the machine turned on?"" gee I never thought of that)",Bluering,0,"January 11, 2020",R1IR1GXBB6OCQ1,C3224dw,Bluering/Lionfish (BRLF),Verified Purchase,,1,WON'T WORK WITH A MAC,0,https://www.amazon.com/gp/customer-reviews/R1IR1GXBB6OCQ1?ie=UTF8&ASIN=B07T6PGM4J,JIM
No,great little laser printer. perfect for my office need.,Bluering,0,"January 9, 2020",R3G5C2GJT5MYVR,C3224dw,Bluering/Lionfish (BRLF),Verified Purchase,,5,perfect print quality,0,https://www.amazon.com/gp/customer-reviews/R3G5C2GJT5MYVR?ie=UTF8&ASIN=B07T6PGM4J,mei zhou
No,It was a gift but it works pretty good,Bluering,0,"January 9, 2020",R3CX6DSV55FXT3,C3224dw,Bluering/Lionfish (BRLF),Verified Purchase,,5,They loved the gift,0,https://www.amazon.com/gp/customer-reviews/R3CX6DSV55FXT3?ie=UTF8&ASIN=B07T6PGM4J,Alan Krepel
No,"Used for every day printing, including photos, works very good. Still learning the ins and outs, I've had the printer for a month now.",Bluering,0,"January 7, 2020",R37XIOL5SYHI5V,C3224dw,Bluering/Lionfish (BRLF),Verified Purchase,,5,So far so good,0,https://www.amazon.com/gp/customer-reviews/R37XIOL5SYHI5V?ie=UTF8&ASIN=B07T6PGM4J,Pathfinder
No,It's my first color laser printer. I'm very happy with it.,Bluering,0,"January 6, 2020",R2FW5GIN1X9NWA,C3224dw,Bluering/Lionfish (BRLF),Verified Purchase,,5,Works great,0,https://www.amazon.com/gp/customer-reviews/R2FW5GIN1X9NWA?ie=UTF8&ASIN=B07T6PGM4J,Elisia
No,Great quality for $116. A laser print is so much better than a dot matrix.,Bluering,0,"January 5, 2020",RVK9HJ6VR8WV6,C3224dw,Bluering/Lionfish (BRLF),Verified Purchase,,5,Great quality for almost no money.,0,https://www.amazon.com/gp/customer-reviews/RVK9HJ6VR8WV6?ie=UTF8&ASIN=B07T6PGM4J,E. Saltzberg
Yes,"I'm terribly disappointed with what this printer has produced. My heart sank on the first test page when what came out appeared to have been the product of an inkjet printer. I really thought I had mistakenly paid for an inkjet the quality is so poor. And now I've gone from feeling like a sucker to being completely furious.I causes me to reconsider that value of Amazon exspecially for more expensive items. I very much wanted to make use of this printer today. I don't get much time off. I don't have time for BS.If I had gotten this at a brink-and-morter, I could solve this problem today. I'd go back to the store, show them the garbage that came out of this printer and they'd likely help me. I'd get back home and could continue with today's work.Instead now I've got to go through the pain of trying to figure out exactly what hoops I've got to jump through to get satisfaction.It's possible that it's not the printer itself that's the problem but instead the toner cartridges it came with. That doesn't matter and it doesn't help me. I need a working device now. I don't have it. I've tried shaking the cartidges but it doesn't help.I've included a video showing what the printer produced. Note the inkjet printer-like patterning in the rainbow image. Even basic black text is spotty and broken.",Bluering,3,"January 5, 2020",R1XAOQKUSXSH8Z,C3224dw,Bluering/Lionfish (BRLF),Verified Purchase,"We hate to hear your frustration and would love to fix this situation for you. Lexmark products are designed and tested for quality and reliability, and what you are describing clearly does not meet those standards. Please call 1-800-LEXMARK (1-800-539-6275) Monday-Friday 8:00am to 9:00pm EST and selecting the option for technical support for us to help.",1,From sucker to furious.,35,https://www.amazon.com/gp/customer-reviews/R1XAOQKUSXSH8Z?ie=UTF8&ASIN=B07T6PGM4J,ScotA
No,"When setting up the printer I kept getting a persistent error message ""Remove Cartridge Packaging "" even though I had removed all the packaging. Went through online troubleshooting to no avail. Phone support was very courteous, but repeated the online troubleshooting again to no avail. Lexmark is sending out another printer but I will have to transfer the print cartridges, paper tray, and waste toner bottle from the defective printer to the new printer when it arrives.Update: I am upgrading my rating from 1 start to 4 stars. I received the replacement printer, unpacked it (was very careful pulling the plastic tabs off of the toner cartridges), and it started up without any problems. My Windows 10 pc found it on my network immediately and I was able to print with no problems. I am subtracting 1 star because of the hassle of dealing with a dead-on-arrival product, having to take the return to the ups store, etc..",Bluering,0,"December 24, 2019",R1W1Z6HHF2JMX5,C3224dw,Bluering/Lionfish (BRLF),Verified Purchase,,4,Did not work out of the box,2,https://www.amazon.com/gp/customer-reviews/R1W1Z6HHF2JMX5?ie=UTF8&ASIN=B07T6PGM4J,Family Man
No,"Sometimes it takes a to much time to print color files, but in general, it works well",Bluering,0,"January 21, 2020",R1V3GT3OI6QDMG,C3224dw,Bluering/Lionfish (BRLF),Verified Purchase,,4,Good price,0,https://www.amazon.com/gp/customer-reviews/R1V3GT3OI6QDMG?ie=UTF8&ASIN=B07T6PGM4J,marcel ferrer
No,"Unfortunately, A) the setup process is a bit janky; luckily I have a bit of tech background and was able to put in the proper networking info manually to get it online. Print quality is good, but then I went to get some toner, and all I can find is $300 toner sets. 3x the cost of the device itself...yeah, no especially when there are Brothers available with $60 after-market toner.",Bluering,0,"January 19, 2020",R1UEICG3FK2BBJ,C3224dw,Bluering/Lionfish (BRLF),Verified Purchase,,2,Toner is out-of-this-world expensive,5,https://www.amazon.com/gp/customer-reviews/R1UEICG3FK2BBJ?ie=UTF8&ASIN=B07T6PGM4J,D. Engel
No,"Have not had the opportunity to print a large quantity of pages yet so I can't include durability or speed in my review. I can only write that the quality is very good. The few pages I did print in one que was very fast and quiet from both my MacBook and iPhone. I did not experience any problems in connecting the wifi and it only took minutes to connect. The negative -- screen is kind of small which makes it difficult to read and in the past I have personally used and owned inkjet so the unit was a lot heavier then Im used to. I don't know how the toner cartridges are set up in terms of black and if the color are all in one or separate.The primary purpose of me purchasing a laserjet is I got tired of the inkjets clogging and so far I am very pleased with that aspect and the overall performance of this lexmark printer. To me it was well worth the almost literal few dollars extra for piece of mind in knowing it so far is dependable in printing if I don't print for a week, or two or more. I think the value is extremely good considering it is not a monotone printer but a color laserjet.",Bluering,0,"January 19, 2020",R3EL6XIMQMZ64F,C3224dw,Bluering/Lionfish (BRLF),Verified Purchase,,5,Great value,0,https://www.amazon.com/gp/customer-reviews/R3EL6XIMQMZ64F?ie=UTF8&ASIN=B07T6PGM4J,christopher
No,"Business, educational, personal",Bluering,0,"January 19, 2020",RDP4CHVHPOOE8,C3224dw,Bluering/Lionfish (BRLF),Verified Purchase,,5,Great printer for home business,0,https://www.amazon.com/gp/customer-reviews/RDP4CHVHPOOE8?ie=UTF8&ASIN=B07T6PGM4J,Judith Kumar Watkins
No,"Don't even know where to begin. In short, it's defective and no amount of fussing, firmware updating, ""Color Calibrating"" will fix it. The black image is shifted about 1/16th of an inch from all of the color images. Looks like a weird ghost image on every printout.This issue is not fixable, and tech support is useless. It's going back...",Bluering,0,"January 19, 2020",R3HGXA56ZCTTME,C3224dw,Bluering/Lionfish (BRLF),Verified Purchase,,1,This printer's ONLY good feature is its price,0,https://www.amazon.com/gp/customer-reviews/R3HGXA56ZCTTME?ie=UTF8&ASIN=B07T6PGM4J,Ira Rosenberg
No,The printer was damaged and I was not able to install it. I had to return it.,Bluering,0,"January 18, 2020",R197AIJ5OWG5E1,C3224dw,Bluering/Lionfish (BRLF),Verified Purchase,,1,Don't buy this printer,0,https://www.amazon.com/gp/customer-reviews/R197AIJ5OWG5E1?ie=UTF8&ASIN=B07T6PGM4J,Tech User
No,Printer purchased for $118. Great deal right? Wait till you have to buy toner for it. At around $75 each it will cost you $300 to put ink in this printer. Ha!I am updating my review on this printer after over a month of use. At first I was very concerned over the cost of the cartridges. After using it for a while now I am extremely concerned over the cost of the cartridges and the actual pages you get per cartridge.I am printing shipping labels with this printer in black and white. I got about 170 lables with the partial cartridge that it comes with. Today I ordered the third black cartridge from Lexmark. According to the printer count I have printed a total of 766 pages and have used up the starter cartridge and one of the brand new full cartridges. This is an absolutely miserable page count considering Lexmark claims I should be getting 1500+ pages per cartridge.The only reason I went with this printer was because I used to run a Lexmark 250DN printer here in the office. We got well over 1000 pages on each cartridge with that old printer. Guess newer isn't always better. Sad.,Bluering,0,"January 17, 2020",R3N9UDSF8XE674,C3224dw,Bluering/Lionfish (BRLF),Verified Purchase,,1,Beware of expensive toner,6,https://www.amazon.com/gp/customer-reviews/R3N9UDSF8XE674?ie=UTF8&ASIN=B07T6PGM4J,Romean Bassiri
No,"After 1 1/2 hours unpacking, setting up, and dealing with Lexmark technical support, they finally said this model is NOT compatible with the mobile printing app and CANNOT be used as a network printer and will NOT print wirelessly.Many manufacturers produce lower quality, lower-end products specifically for high-volume retailers like Amazon, Walmat, Home Depot, etc. The retailer dictates the price point and the manufacturer uses cheaper parts, removes functions, etc.This is one of those. Every other model of Lexmark is compatible with their mobile printing app, which is required to print wirelessly from your phone, tablet, etc This one isn't.If you need to print wirelessly do NOT buy this printer.",Bluering,1,"January 15, 2020",R1DSGAPNGG525Q,C3224dw,Bluering/Lionfish (BRLF),Verified Purchase,,1,NOT compatible with Lexmark mobile app,10,https://www.amazon.com/gp/customer-reviews/R1DSGAPNGG525Q?ie=UTF8&ASIN=B07T6PGM4J,msbav8r
No,This printer is excellent for the price. It prints nicely. It's easy to set up. The features are good. I'm happy with it.,Bluering,0,"January 14, 2020",R350CWIIY86YOT,C3224dw,Bluering/Lionfish (BRLF),Vine Customer,,5,Great printer for the price,0,https://www.amazon.com/gp/customer-reviews/R350CWIIY86YOT?ie=UTF8&ASIN=B07T6PGM4J,Jamie and Heather Hejduk
No,"Great for first 4 months, now I’ll not connect to computer anymoreThis printer is amazing it came with enough ink to print 100 full color pages and I’m still going this is a must buy if you want a laser printer",Bluering,0,"January 12, 2020",R52NIBV9IQFR5,C3224dw,Bluering/Lionfish (BRLF),Verified Purchase,,2,Must not buy,0,https://www.amazon.com/gp/customer-reviews/R52NIBV9IQFR5?ie=UTF8&ASIN=B07T6PGM4J,Christian E Belcastro
No,I would not purchase again! Print quality is great but the cartridges are more expensive than the printer! DO NOT BUY! Get a different one!,Bluering,0,"February 24, 2020",R3C7YDV8538LJ6,C3224dw,Bluering/Lionfish (BRLF),Verified Purchase,,1,Not worth the money! Cartridges too expensive!!,3,https://www.amazon.com/gp/customer-reviews/R3C7YDV8538LJ6?ie=UTF8&ASIN=B07T6PGM4J,Laurie Ballora
No,"A DISK, 3 CALLS TO IT, 3 FAILED ATTEMPTS FROM LEXMARK TO GET INTO MY COMPUTER. IT WEIGHS A TON, AND DOES NOT WORK. WIRELESS APPS, PHONE CALLS, AND IT PROFESSIONAL AND THREE FAILED ATTEMPTS FOR SOMEONE TO REMOTE IN AND FIX.. WORTH LESS AND GET OUT OF THE BUSINESS.",Bluering,0,"February 17, 2020",R248OY3VSA2N60,C3224dw,Bluering/Lionfish (BRLF),Verified Purchase,,1,JUNK JUNK JUNK,0,https://www.amazon.com/gp/customer-reviews/R248OY3VSA2N60?ie=UTF8&ASIN=B07T6PGM4J,beavercopa
Yes,"doesn't print, plain and simple. tried to print through network and through USB cable, and no Windows 10 drivers???? its 2020!!!! waste of time and money. Website is useless, just says to install Windows 8.1 drivers but they don't work. first and last time I buy a Lexmark product",Bluering,1,"February 16, 2020",R2ZS5TI97LAWMH,C3224dw,Bluering/Lionfish (BRLF),Verified Purchase,"We are sorry to hear about your difficulty configuring the C3224dw, Tony. This product is fully compatible with Windows 10 (both 32-bit and 64-bit versions). We recommend checking out the resources at support.lexmark.com. Once at this support page, simply enter the Product Name ""C3224"" and then go to the ""Drivers and Downloads"" link where you will find the Windows 10 drivers. You will also find access to live chat and other product manuals, guides, and other resources. If you are in need of further assistance, please call 1-800-LEXMARK (1-800-539-6275) Monday-Friday 8:00am to 9:00pm EST and select the option for technical support.",1,TRASH,0,https://www.amazon.com/gp/customer-reviews/R2ZS5TI97LAWMH?ie=UTF8&ASIN=B07T6PGM4J,Tony Divine
No,"This is a great printer, easy to connect to WiFi",Bluering,0,"February 16, 2020",R2USZC0LMS5UHY,C3224dw,Bluering/Lionfish (BRLF),Verified Purchase,,5,Value++++++,0,https://www.amazon.com/gp/customer-reviews/R2USZC0LMS5UHY?ie=UTF8&ASIN=B07T6PGM4J,dedw
No,can't even get the printer on! keeps giving error saying remove packaging. Been on the phone with tech support for over an hour trying to get it to work. Longest brand new printer setup hassle i've ever experienced. Can't print. Waiting for someone to email me back to see what to do about it.The replacement arrived and was a long nightmare to install. I'm quite tech savy and could not get wireless printing to work at all. Tired of dealing with extensive setup so just returning. My laptop has no CD drive and trying to connect from laptop or phone was too complicated. Felt like i stepped back to 1999 and just gave up.,Bluering,0,"February 14, 2020",R2BBHFLB8X3CBJ,C3224dw,Bluering/Lionfish (BRLF),Verified Purchase,,1,immediate problems. never got it working.,0,https://www.amazon.com/gp/customer-reviews/R2BBHFLB8X3CBJ?ie=UTF8&ASIN=B07T6PGM4J,Deanomite
No,"I was looking forward to trying this printer out. I followed the setup instructions precisely, and noticed that it was hard to open and close the cartridge tray door. The printer reported a 29.43 error about cartridge packaging material still being present. I checked carefully twice, but I had removed all the packaging material. I could not get past this error. LexMark tech support was closed, and they had a non-useful web page about this error, leading me to believe that this may be a common manufacturing defect.Printers are problematic enough when they have been in use for months and years, so I don't want a printer that has problems when it is brand new. I returned it.",Bluering,0,"February 10, 2020",R31PVVAS6QHZH1,C3224dw,Bluering/Lionfish (BRLF),Verified Purchase,,1,DOA with cartridge packaging material error,1,https://www.amazon.com/gp/customer-reviews/R31PVVAS6QHZH1?ie=UTF8&ASIN=B07T6PGM4J,Kevin P
No,"I followed some of the advice from others who let comments (e.g. Once my router gave it a DHCP address I made it static). Afterwards, my devices were quickly able to locate it. I printed acolor photo from two and a text page from the rest. I have not tried to print a multipage document yet, but the pictures were high enough quality on standard paper that I could have them freshness. Set up was not easy, but I wouldn't call it difficult. I will update this once I have attempted a multipage document and buy my first replacement toner. Thus far I am very satisfied with its results.I printed a full color 39 page double sided document over WiFi. The document includes color graphs, color and black and white text, images, and color tables. From the time I pressed the print button until it completed printing was 4 minutes and 30 seconds. Every detail on each page is quality. There is no smudging. Each page is perfectly aligned from front to back.I am perplexed about all of the 1 star complaints, this printer is awesome!",Bluering,0,"February 3, 2020",R3CAO4DFVVR0BA,C3224dw,Bluering/Lionfish (BRLF),Verified Purchase,,5,Excellent printer for the price,17,https://www.amazon.com/gp/customer-reviews/R3CAO4DFVVR0BA?ie=UTF8&ASIN=B07T6PGM4J,John C
No,Very impressed. Not crazy fast but is the first one I have bought that actualy does auto 2 side printing. Saves me alot of paper and dont have to feed the paper in a second time.,Bluering,0,"February 2, 2020",R2XUIE4LW1YKR,C3224dw,Bluering/Lionfish (BRLF),Verified Purchase,,5,Great printer for the price,2,https://www.amazon.com/gp/customer-reviews/R2XUIE4LW1YKR?ie=UTF8&ASIN=B07T6PGM4J,Amazon Customer
No,"Setup was a breeze with my macbook, took less than 5 min. Quality and speed are outstanding. I love it",Bluering,0,"January 25, 2020",R1HHFCRZU2QV5O,C3224dw,Bluering/Lionfish (BRLF),Verified Purchase,,5,Excellent Color Printer,2,https://www.amazon.com/gp/customer-reviews/R1HHFCRZU2QV5O?ie=UTF8&ASIN=B07T6PGM4J,Ed
No,"This thing makes me feel dumb that I never bought one years ago and why this is not considered more on top printer lists as an economy buy. I've wasted so much money on bad inkjet printers that clog over time not to mention all the ink cartridges. I run a small business and need a printer only sporadically for invoicing and bulk photo printing. The review...1. The setup was not without it's challenges. You just need to make sure that you connect the Wifi to the printer first through the printer control panel then proceed with downloading the appropriate drivers/apps for your device. I found it really easy to connect the devices actually. My Google phone and Chromebook latched on immediately. I could see how others could have issues figuring this out though. I'm fairly tech savvy but it still took me a few minutes of fiddling. I don't understand the lack of included instructions out of the box or online. You really just need a small note card that could walk you through it but nothing, weird. The printing software is nothing to write home about and typically no frills.2. Quality for text is very good of course since it's a laser. Photos are okay. They aren't as poppy or crisp as most inkjets in the same price range but it's passable, at least for my needs. I didn't expect too much for the photo printing (due to reviews I read) but it actually met or exceeded my expectations. If photos are your main interest then you shouldn't be looking at a laser anyway.3. Although this is compact compared to other laser printers, it's not exactly small. It takes up as much space as a small multifunction inkjet. The advantage is that I can shove this unit into a shelf because it doesn't have a scanner top that you need to lift. I realized over time that I use a scanner maybe once a year so I wanted forgo that function.Initially, I am super happy with this. The price is amazing!! It does exactly what I need it to do for use as a basic office printer. I've been buying inkjets all my life. I hope that I don't have to deal with clogged printer heads ever again. I was also weary of buying a 'Lexmark' since there is very little hype about this brand. But I love the no frills design and function of this unit. If I encounter issues then I will update this review. Otherwise, assume this thing is still kicking butt.",Bluering,0,"January 23, 2020",R2JJXVDPKZCTPB,C3224dw,Bluering/Lionfish (BRLF),Verified Purchase,,5,Excellent,9,https://www.amazon.com/gp/customer-reviews/R2JJXVDPKZCTPB?ie=UTF8&ASIN=B07T6PGM4J,Benjamin Lai
No,"The printer itself is pretty good. It prints great colored prints, not necessarily top grade for photographers, but sufficient enough for everyday-use colored fliers and portraits. After reading the other reviews, I thought I wouldn't have any issues with connections and that the other buyers complaining of connection issues were isolated incidents; I was wrong. What good is a printer that prints excellent pictures but constantly disconnects from your devices when you need it?! It was constantly offline. I decided to return and go with a more reliable Canon.",Bluering,0,"March 13, 2020",R12R4GJFF35RYO,C3224dw,Bluering/Lionfish (BRLF),Verified Purchase,,2,"Great quality, bad connection problems.",0,https://www.amazon.com/gp/customer-reviews/R12R4GJFF35RYO?ie=UTF8&ASIN=B07T6PGM4J,Raleigh Araga
No,i like,Bluering,0,"March 11, 2020",R23V3FK5MSBLUV,C3224dw,Bluering/Lionfish (BRLF),Verified Purchase,,5,nbice,0,https://www.amazon.com/gp/customer-reviews/R23V3FK5MSBLUV?ie=UTF8&ASIN=B07T6PGM4J,Luis Proano
No,"I had problems getting the wifi working but with some tech support help worked thru it. And then all the apple devises connected for a while but now can no longer find the printer. It was a pain to get it hooked up so i said screw it and send all my work to the pc. Guess what, the pc can no longer find this printer. So now i am looking to get a wire. Damn it. Or call tech support again but reading others reviews has me thinking this may have been a bad purchase it i wanted wifi. I don’t know.",Bluering,0,"March 10, 2020",R1K5L8J0WP5ET5,C3224dw,Bluering/Lionfish (BRLF),Verified Purchase,,2,Update,0,https://www.amazon.com/gp/customer-reviews/R1K5L8J0WP5ET5?ie=UTF8&ASIN=B07T6PGM4J,schultz
