LXKresponded,body,codename,comments,date,id,model,program,purchaseType,reply,stars,title,upvotes,url,username
No,"I was nervous getting this printer due to other reviews of it being extremely difficult to set up to WiFi, I even purchased a direct chord for it just in case. But it was extremely straight forward. I recommend scanning the support QR code provided on the sheet of safety hazards and then watch the videos for setting up the printer and wifi. Follow the video step by step and pause as you go. Also the printer does come with ink.",Bluering,0,"May 21, 2020",R1UJU9DD7I2C54,C3224dw,Bluering/Lionfish (BRLF),Unverified,,5,Printer setup is so straight forward and print quality is great as well,0,https://www.amazon.com/gp/customer-reviews/R1UJU9DD7I2C54?ie=UTF8&ASIN=B07T6PGM4J,Jillian Olivar
No,"Do not buy this printer It is a nightmare to install. After 3 days of tech support, the printer did not work. They are sending a new one. But I still may return it anyway. Its total overkill, don't know how it works and it's too big and heavy with no install instructions. The people at the tech support are great, but the printer still doesnt work. Still trying to hook it up.",Bluering,0,"May 19, 2020",R1YBOUUUC8L0V5,C3224dw,Bluering/Lionfish (BRLF),Verified Purchase,,1,Too hard to install and doesn't work with WiFi,0,https://www.amazon.com/gp/customer-reviews/R1YBOUUUC8L0V5?ie=UTF8&ASIN=B07T6PGM4J,Tessa Odowd
No,I do not want a replacement! I want my money back added to my card!!!,Bluering,0,"May 18, 2020",R2XBLZ4H3OKIB3,C3224dw,Bluering/Lionfish (BRLF),Verified Purchase,,1,Complicated,0,https://www.amazon.com/gp/customer-reviews/R2XBLZ4H3OKIB3?ie=UTF8&ASIN=B07T6PGM4J,flyguysteve
No,"So before you buy this printer let me tell you about my issues i had. First i had plugged it in follow the pictures that were given for instructions. (Note: there is no words for the instructions) After i had done so i downloaded the app that it told me to however in the Google play store i did not download the Lexmark printer assistant app which i needed to set it up. I had downloaded the Lexmark print app which was not of help since the printer was not even connected to my WiFi at this point. It took me a good 2 hours just to figure that part out. Then after getting the printer on the WiFi network and all set up on the phone i go to set up on the computer. I have an HP running windows 10 home edition. It took me 4 hours just to get the drivers installed onto the computer and for it to recognized that i had a printer on the WiFi network. I can get test page to print just fine however what i had printed for an actual test print did not print it said error printer offline. The printer clearly says on the little 2 line screen ""Ready"". I started this task at 10:30 am Arizona time it is now 9:33 pm and what i had sent to the printer as a test print is now being printed on its own without my computer being on. Now if only it would print when i tell it to and print the full page not just a half page like the picture i uploaded for reference. JUST DON'T BUY THIS SAVE YOU SELF AND GET A BETTER ONE THAT SOMEONE CAN VOUCH FOR IT.",Bluering,0,"May 16, 2020",R3LGEOVNHZB2N5,C3224dw,Bluering/Lionfish (BRLF),Verified Purchase,,1,Don't buy its a hassle to use,0,https://www.amazon.com/gp/customer-reviews/R3LGEOVNHZB2N5?ie=UTF8&ASIN=B07T6PGM4J,Joe Martinez
No,"I bought this printer for the home ""print a few times a year"" use-case after getting tired of dried out inkjet printers.Pros:Print quality looks good. Ethernet connection worked pretty good.Cons:I could not get wi-fi to work with my router. Some other reviews suggested static IP address. Didn't help for me, there was some connection but it wasn't solid enough to be usable. I think I'm just going to have to use it over ethernet.",Bluering,0,"May 12, 2020",R3HR0M3G8ZEGS,C3224dw,Bluering/Lionfish (BRLF),Verified Purchase,,4,"Good print quality, Couldn't get wifi to work",0,https://www.amazon.com/gp/customer-reviews/R3HR0M3G8ZEGS?ie=UTF8&ASIN=B07T6PGM4J,Zoe Clifford
Yes,"Like most printers. It worked great for months and then just decided to stop working. I've spent the last 2 hours trouble shooting and refraining from going full OFFICE SPACE on this thing. It is displaying ""MEMORY FULL"". I've erased the memory. Restarted. Manually put in WiFi password and restarted again. And still it refuses to print. Always a job you need printed immediately. smh.Could not get a hold of tech support. They do not make it easy.",Bluering,1,"May 12, 2020",R6YI85ACO0VWM,C3224dw,Bluering/Lionfish (BRLF),Verified Purchase,"Thank you for the feedback. Lexmark products are designed and tested for quality and reliability so we understand your frustration. We value our customers and would like to see if we can assist you, but we need more information in order to help. Our technical support line is open Monday-Friday, 8:00am to 9:00pm EST. You can contact them at 1-800-LEXMARK (1-800-539-6275) option 1. ",2,Stopped working.  Memory Full. No solution.,2,https://www.amazon.com/gp/customer-reviews/R6YI85ACO0VWM?ie=UTF8&ASIN=B07T6PGM4J,Jeff P
No,"ink replacement program is not accepting any new comers, yet they still sell the product.... It costs less to buy a whole new printer than to replace the ink. Great!! now we will have tons of printers stacked all over the place.!!!🤷‍♀️",Bluering,0,"May 8, 2020",R1K8KKBKGPEZD4,C3224dw,Bluering/Lionfish (BRLF),Verified Purchase,,3,WTH????,2,https://www.amazon.com/gp/customer-reviews/R1K8KKBKGPEZD4?ie=UTF8&ASIN=B07T6PGM4J,Shelly
No,"It's a great printer. Fast, does a beautiful job, no sarcasm here.At the time of this writing, it costs under $200. Replacement toner from Amazon (cyan, yellow, magenta, black) is $335. ???",Bluering,0,"May 7, 2020",R25L8V4Y9295C2,C3224dw,Bluering/Lionfish (BRLF),Verified Purchase,,2,Look for replacement toner before buying this printer,1,https://www.amazon.com/gp/customer-reviews/R25L8V4Y9295C2?ie=UTF8&ASIN=B07T6PGM4J,Kevaz0n Oh1o
No,Like about good quality but cartridge expensive,Bluering,0,"April 27, 2020",R2S2EOC0U5B6CK,C3224dw,Bluering/Lionfish (BRLF),Verified Purchase,,5,Good quality and heavy,0,https://www.amazon.com/gp/customer-reviews/R2S2EOC0U5B6CK?ie=UTF8&ASIN=B07T6PGM4J,kanwar
No,"I have to say that I've had a lot of printers in my life, but this one seems to be the easiest I've had to get connected to WiFi. And I can print from my iPhone! Any computer just connects and prints, without even any setup on the devices/laptops. Impressive. Perfect size - not too big. All the features. Good price. No complaints.",Bluering,0,"April 24, 2020",R2HAJS2HEJAAJ4,C3224dw,Bluering/Lionfish (BRLF),Verified Purchase,,5,Great printer.  Easy to connect to WiFi network.,0,https://www.amazon.com/gp/customer-reviews/R2HAJS2HEJAAJ4?ie=UTF8&ASIN=B07T6PGM4J,Amazon Customer
No,"I bought this at a much lower price before the epidemic started. It's a good printer, easy to setup and I can print from multiple devices in my house.My Main issue is how the seller has Jacked up the prices to almost twice the amount suddenly after the epidemic started.",Bluering,1,"April 24, 2020",R6E11ZPS7PDD2,C3224dw,Bluering/Lionfish (BRLF),Verified Purchase,,5,I'm glad I bought this before the seller jacked up the prices,2,https://www.amazon.com/gp/customer-reviews/R6E11ZPS7PDD2?ie=UTF8&ASIN=B07T6PGM4J,I bought this
Yes,This is a horrible printer and is not working correctly. When I first got it. I set it up and that was easy enough. I printed a resumè and that took forever but it finally printed. And now I tried to print one picture of a police flag and it printed out about 40 small sections of the pic before it finally went through all the way. ( see pic included )This is a horrible product and I would not recommend anyone but it EVER!,Bluering,1,"April 24, 2020",R96DKOBZB1QOA,C3224dw,Bluering/Lionfish (BRLF),Verified Purchase,"We appreciate you taking the time to provide a review of your experience. This printer outputs up to 24 pages per minute for both black and color, though performance may be affected by factors such as document complexity and network speeds. If you have any issues requiring additional support, please call our Lexmark technical support line at 1-800-LEXMARK (1-800-539-6275) Monday-Friday, 8:00am to 9:00pm EST (option 1).",1,Worst printer ever,1,https://www.amazon.com/gp/customer-reviews/R96DKOBZB1QOA?ie=UTF8&ASIN=B07T6PGM4J,Anthony Gambino
Yes,"when I needed to buy a toner I found that there is no genuine toner, that is, it is a disposable product, for the cost of toner it is feasible to buy a new printer that accepts genuine toners",Bluering,1,"April 18, 2020",R312W6349D4H2X,C3224dw,Bluering/Lionfish (BRLF),Verified Purchase,Thank you for your review of the C3224; we appreciate your feedback. This product does in fact have genuine toner available. You can visit Lexmark’s official website and type in “C3224” in the search box for your product’s genuine toner cartridge offering.,1,No,1,https://www.amazon.com/gp/customer-reviews/R312W6349D4H2X?ie=UTF8&ASIN=B07T6PGM4J,Danila
Yes,"This printer was great in the beginning. Then the minute I needed toner, errors began. With everything! I spent over $300 on four toner cartridges directly from Lexmark’s recycle program: where you use it once and send it back. That was the cheapest I could find for legit toner. That was more than the printer cost in the beginning! Then the errors began. Toner not recognized. Fisher needed attention. Toner waste bottle needed changing although it’s supposed to hold way more than what it’s has in it. One minute it prints. One minute it doesn’t. Since getting it to work with the LEXMARK toner, occasionally it looks faded, with brand new toner! I’ve had other brands of laser printers before and they worked so much better and toner didn’t cost as much as a car payment. When this ones fully dead, I will NEVER buy another Lexmark product again!",Bluering,1,"April 18, 2020",R1H9XVGAWC6CWF,C3224dw,Bluering/Lionfish (BRLF),Verified Purchase,"Thank you for your review; we appreciate your candid feedback. The errors you are describing, not only sound frustrating, but atypical. We would like to get you back up and running – with no errors and crisp prints. Please call the Lexmark technical support line at 1-800-LEXMARK (1-800-539-6275) Monday-Friday, 8:00am to 9:00pm EST (option 1) so we can assist.",1,"Expensive toner, prints when it wants, not worth the money!",0,https://www.amazon.com/gp/customer-reviews/R1H9XVGAWC6CWF?ie=UTF8&ASIN=B07T6PGM4J,Robin Nicole
No,"We ordered this for a customer, and it stopped working within 6 months (closer to 4 months, actually) ... we have contacted the manufacturer directly and ZERO help.",Bluering,0,"April 17, 2020",R1IC0UEXTMZ8V3,C3224dw,Bluering/Lionfish (BRLF),Verified Purchase,,1,Stopped working and zero help from the manufacturer,0,https://www.amazon.com/gp/customer-reviews/R1IC0UEXTMZ8V3?ie=UTF8&ASIN=B07T6PGM4J,Derek Davis
No,"After reading some of the reviews I was very wary about buying this printer. I needed a color laser and I spent around $400 dollars on my last color laser and it only lasted two years. At around $141 plus tax, I went ahead and took a shot on this printer. So far I have been very pleased. It prints photos as well as my old expensive printer and the text looks very nice. I guess i will see later how long the toner lasts. But at this price point, the print seems well worth it!",Bluering,0,"April 13, 2020",R1SWL6XZQ4JW7L,C3224dw,Bluering/Lionfish (BRLF),Verified Purchase,,5,Great little printer for the money,1,https://www.amazon.com/gp/customer-reviews/R1SWL6XZQ4JW7L?ie=UTF8&ASIN=B07T6PGM4J,Chad Guynn
No,"I ALMOST made the mistake of buying this, but luckily I searched for the replacement cartridges and discovered they are $335 for the 4 cartridges! That is a TOTALLY INSANE price, this very day on Amazon you can get a Canon Color Image CLASS LBP622Cdw (Wireless, Mobile Ready, Duplex Laser Printer, Compact Size) for $206, and a full set of High Yield replacement toner cartridges with and extra HY black is &79.99!And I have searched hi and lo here at Amazon, and have not found a generic or aftermarket for this lexmark printer!I'm ordering the Canon!",Bluering,0,"April 12, 2020",R14YDU1EKR9CA5,C3224dw,Bluering/Lionfish (BRLF),Unverified,,1,Warning! Replacement toner cartridges are insanely expensive!,1,https://www.amazon.com/gp/customer-reviews/R14YDU1EKR9CA5?ie=UTF8&ASIN=B07T6PGM4J,momma1
No,Easy to set up. Prints really nice. I love being able to print from my cell phone. I definitely recommend this home printer.,Bluering,0,"April 12, 2020",R252Z76NKT3GMV,C3224dw,Bluering/Lionfish (BRLF),Verified Purchase,,5,Awesome printer,0,https://www.amazon.com/gp/customer-reviews/R252Z76NKT3GMV?ie=UTF8&ASIN=B07T6PGM4J,shelly
No,"It will not sync with my phone or computer. Therefore, I cannot print. I called to get tech help and he could not even help. Stayed on phone way too long and still didn't work. Don't buy this.",Bluering,0,"April 9, 2020",R2PA0X0228479,C3224dw,Bluering/Lionfish (BRLF),Verified Purchase,,1,Don't buy,0,https://www.amazon.com/gp/customer-reviews/R2PA0X0228479?ie=UTF8&ASIN=B07T6PGM4J,maders
No,"I never have been able to connect to wi-fi even though I have gone through the set up process many times. The Lexmark support scan is a joke. A simple one page set-up instructions (in English) is all it would have taken. Instead what comes in the box are 3 pages of Safety information in about 30 languages (and only 4 lines of 3 pages are in English). Then the other 2 pages are also full non-English rubbish. Four months after buying and using maybe once per week or two, it prints blank pages. It gave no warning of low ink, however. I can only assume that's the problem. The Lexmark replacement cartridges on Amazon are $375.00!! I'm considering buying a different brand printer all together and starting over.",Bluering,0,"April 9, 2020",R24YBV1JIPSPF3,C3224dw,Bluering/Lionfish (BRLF),Verified Purchase,,1,Wi-fi connect is impossible and ink refils very expensive,0,https://www.amazon.com/gp/customer-reviews/R24YBV1JIPSPF3?ie=UTF8&ASIN=B07T6PGM4J,Melinda D
Yes,"This printer will not connect to your network. If it does, it will go back offline within 60 seconds. Don’t bother downloading the app...it’s not compatible with this particular model. Don’t bother calling customer service...they will tell you to go watch YouTube videos. Seriously. After being out on hold 6 times, the rep gave me a list of 3 YouTube videos to watch that “should” fix my problem. It didn’t. The QR Code that’s supposed to be easily scanned to connect your devices WILL NOT SCAN. I wasted two days trying to connect this piece of junk to my phone and it’s impossible.",Bluering,4,"August 17, 2019",R2EW0NEGXA5SGE,C3224dw,Bluering/Lionfish (BRLF),Verified Purchase,"We are sorry to hear you are having issues with wireless connectivity. If you would like to reach out to Lexmark Technical Support at 1-800-539-6275 (1-800-Lexmark), we would be glad to assist you. To help expedite this process, we have already started a ticket for you. Please reference SR 1-312 808 896 974 when you talk to the support agent.We wanted to also let you know the technical support experience you described does not sound like advice or behavior you would get from Lexmark Technical Support. We do not sell software to fix customer issues. There are other 'customer support' companies that try to trick customers into paying for services they do not need. Some will pretend to be Lexmark. We look forward to hearing from you.",1,DO NOT buy this printer if you need it for wireless devices!!!,46,https://www.amazon.com/gp/customer-reviews/R2EW0NEGXA5SGE?ie=UTF8&ASIN=B07T6PGM4J,Queenie_501
Yes,"I took a chance and got this printer based on the positive Amazon Vine reviews. The set up was a breeze, even using just the control panel and not the app. However, I tried printing a 20-page PDF that has a file size of 5mb. The printer could not process the PDF and would only print a single page and give me an error saying that the memory is full. So then I tried to just print two pages from the PDF, and it can't even handle that. If it can't print a multi-page document it is pretty worthless. And there is no way you can print 24 pages a minute if you have to print them one page at a time. If you just want to print a single page all the time, than this printer would be great for you, and the print quality was good. But if you need to print a multi-page document... you'll want to look somewhere else. Needless to say, I will be returning this and buying another HP or Brother printer.Update #1 - I spent a whole day trying to get this printer to work. I reinstalled it multiple times, restored factory settings, reset it up, updated the printer firmware, updated my operating system, and then finally figured out that if I installed it using generic post script printing and boom! it works. There was zero support on the Lexmark website. So they lose a star for that.",Bluering,1,"August 12, 2019",R39U02I9NMEL2E,C3224dw,Bluering/Lionfish (BRLF),Verified Purchase,Thank you for your purchase of the Lexmark C3224 and taking the time to post a review.  We apologize for the difficulties you experienced in setting up the print drivers on your purchase and commend you for the diligence in troubleshooting to get your purchase up and running.  We would like to highlight that our support team at 1-800-LEXMARK are highly skilled in these types of issues and are a wonderful resource to assist you with any future questions or issues you could experience. ,4,Doesn't have enough memory to print multi-page documents,76,https://www.amazon.com/gp/customer-reviews/R39U02I9NMEL2E?ie=UTF8&ASIN=B07T6PGM4J,Benjamin H. George
No,"I believe this is my first experience with a Lexmark printer. Installing it was not nearly as easy as I expected, especially given the experiences I’ve had with other brands. It took multiple tries and loads of patience to finally get it done.You have to have a smart phone to install this. I tried to install from my laptop and it wouldn’t. I was required to download an app from Lexmark to just connect my phone and printer. Then I was able to use that app to connect the printer and my internet. Once that was completed I was able to connect to it with the laptop. To print from my phone, it looks like another app is needed.I did to a test print and it seems to be working. The printing was fine but not as crisp as I expected. But, I’ll see as I use it if that gets better.",Bluering,0,"August 11, 2019",RUCG4UF8O03M3,C3224dw,Bluering/Lionfish (BRLF),Vine Customer,,4,Lexmark Color Laser Printer,0,https://www.amazon.com/gp/customer-reviews/RUCG4UF8O03M3?ie=UTF8&ASIN=B07T6PGM4J,H. Martin
No,This took about 10 minutes from box to working. The longest part of it was loading the disk onto my computer so it could print wirelessly. I used the mobile app to get it started and then popped in the disk and I was ready to go. It's probably the easiest printer I've ever set up. I sent some color pages to the printer and it did a beautiful dual side printing where the colors on the paper look just like the original did from my screen. A simple basic laser color printer. This is a winner!,Bluering,0,"August 8, 2019",R37RL5T5TGKE8V,C3224dw,Bluering/Lionfish (BRLF),Vine Customer,,5,Easy to Setup and Great Looking Output,0,https://www.amazon.com/gp/customer-reviews/R37RL5T5TGKE8V?ie=UTF8&ASIN=B07T6PGM4J,MyOhMy
No,"=== My Take ===The Lexmark C3224dw is my first ever color laser printer and I like it very much for the most part. I like its compact and space-saving design and dimensions despite its heavier than expected heft. The control panel screen is bright & clear and the buttons around it are very responsive to my inputs. It is very intuitive to operate even without consulting the user manual first.I also liked its print quality - both in color and black & white. Text and images came out clear and smudge-free and the printing speed was satisfactory. Print operations were quiet, even the warm-up routine. Intermittently, however, the printer took an unusually long time to wake up from its Sleep & Hibernate status. There were times when we waited for longer than 30 seconds before the printer began flashing its light & started to print. Once it got warmed up, though, all later printer jobs printed at normal and satisfactory speeds.Another strong point for the C3224dw is its fast and simple setup process. I added it to my home network using just the control panel buttons to select my home WiFi and typing in the password. This process was seamless and very smooth. I also connected the printer to my desktop via a USB Type B cable (not included in the box) and installed the printer by installing the driver package from the Lexmark website. You also have the option to set it up using an Ethernet cable (also not included).Despite easily adding the printer to my home WiFi, however, none of my Windows 10 laptops around the house could find the printer during an actual print job, such as from Microsoft Word and Chrome browser. My wifey, who is not very techy, got frustrated because the printer wasn't listed in the printer selection drop-down menu. I had to go to Settings in Windows 10 and add the printer manually by typing in its IP address on each of my laptops. Compared to my other printers from Brother and HP, this part of my printing experience was subpar and disappointing. I expected a big printer company such as Lexmark to do a better job integrating the C3224dw to Windows 10.Another surprising thing was that there was no Windows 10 Lexmark app for the C3224dw printer. In order to access its settings, I had to launch the Embedded Web Server by opening a browser such as Chrome and then typing in its IP address. I guess some people might prefer this approach because it is one less app you have to install but I wouldn't have minded a Windows 10 app. You can install the Lexmark phone app but I chose not to do so because I have too many apps installed already on my Galaxy S10+ (>200).Once you access the printer settings via the Embedded Web Server, things are pretty straightforward and easy to navigate within. There are two main settings categories - Status & Settings. Under Status, you can view any Alerts & Warnings messages, Supply/Toner status, and printer info (firmware version, paper bin status).Under Settings, there are six additional sub-categories: Device, Print, Paper, Network/Ports, Security, and Reports.Under the Device section, I found the following options to be useful for our home - setting up low printer supply email notifications, configuring Sleep & Hibernate timeouts, turning on Eco Mode, and performing a firmware update.Inside the Print section, I turned on Duplex printing & the Collate option and set image printing to ""Auto Fit.""Inside the Network/Ports section, I left alone all the numerous options at their default (Wireless, AirPrint, Ethernet, TCP/IP, SNMP, IPSec, 802.1x, LPD, HTTP/FTP, USB, Restrict external network access, WiFi Direct) but did activate Google Cloud Print.I also left everything at default in the Security sub-section.Although the Settings page is plain and simple-looking, navigation among the options was quick, responsive, and very satisfactory and I appreciated all options given to me.All in all, I'm happy & satisfied with the Lexmark C3224dw and I don't regret getting it. Hopefully future firmware updates will improve printer wakeup time from its Sleep/Hibernate status._____*Pros:-Easy setup (WiFi or USB Type B).-Control panel buttons are responsive and intuitive to use.-Both color and black & white prints come out nice and clear.-Compact footprint.-Quiet operation.-Supports Lexmark Mobile Print, Google Cloud Print, Mopria Print, Apple AirPrint, and Wifi Direct.-Settings page offer numerous fine-tuning, network, and security options._____*Neutral:-Pretty heavy~!!-Wake-up time from Sleep is longer than I prefer.-Printer didn't get auto-detected by Windows 10 on all of my laptops on my home network. I had to add it manually by entering its IP address.-Performing a firmware update over the Embedded Web Server isn't as easy & simple as doing it with a Windows 10 or smartphone app.-Cartridge replacements will cost around $300 for all four._____*Cons:-Once in a while, print jobs over WiFi took TOO long. Inconsistent response times.",Bluering,0,"August 7, 2019",R2D8D7FIKARD1S,C3224dw,Bluering/Lionfish (BRLF),Vine Customer,,4,Good-value color laser printer with inconsistent wake-up printing time.,1,https://www.amazon.com/gp/customer-reviews/R2D8D7FIKARD1S?ie=UTF8&ASIN=B07T6PGM4J,optimummind
No,"To set up this laser printer. Initially I thought I was not going to be able to do it and would have to get help. Then after looking at it sitting in my kitchen I decided to try. The hardest part was preparing the printer. Removing the covers on the ink, easy. Removing all the tape, easy. Finding copy paper and loading the tray, easy. Now turning it on, easy. Following the instructions, easy. Still waiting for the hard part.. found a picture to test print. My iPad found the printer and picture was printed. Can it be any easier, I don’t think so. I wish I could discuss the specs and other technical information but this lady isn’t knowledgeable. All I know is the printer was easy to setup and printed a great picture.",Bluering,0,"August 6, 2019",R172RBFMX6BYAL,C3224dw,Bluering/Lionfish (BRLF),Vine Customer,,5,So Easy to Set Up,3,https://www.amazon.com/gp/customer-reviews/R172RBFMX6BYAL?ie=UTF8&ASIN=B07T6PGM4J,Nan W.
