id,date,username,badge,stars,model,variation,upvotes,comments,replied,title,url,reply,body
R2TWC5FK33AWL7,"September 23, 2019",Chris,Verified Purchase,2,MC3326adwe,N/A,10,1,No,Not user friendly,https://www.amazon.com/gp/customer-reviews/R2TWC5FK33AWL7?ie=UTF8&ASIN=B07T5PRRXD,,"This is a very old model printer. If you want to just turn on and print, it works fine. If you want to do anything else, like scan as a PDF, don't bother. The settings can not be changed from default, so the only option is to scan as either JPG or TIFF [Welcome back to 2005]. There is no software that installs with the printer making any setup that much harder. The instructions are non-existent, even if you can find something online. If you need functionality that should be common on any printer still on the market, skip this one and go with something newer. Shame on the vendor for not posting the age of the printer, which I found out later was last manufactured in 2015.Note: I called Lexmark tech support to attempt to get the scan setup working, and 1 hour later they still had no clue and gave up. This printer is getting returned."
R291OJN6PJCTIT,"September 18, 2019",J. Peplinski,Vine Customer,4,MC3326adwe,N/A,0,0,No,Powerful and heavy,https://www.amazon.com/gp/customer-reviews/R291OJN6PJCTIT?ie=UTF8&ASIN=B07T5PRRXD,,"I got this for home use, but it's really somewhere between a home printer and an office printer. Typically most people don't use a laser printer at home because the replacement toner is so crazy expensive, but this isn't enough printer for a huge office either. Maybe a very small business, even a home business? It definitely yields very professional results.It took me a little while to get it set up, as I don't have a disc drive (it comes with an install disc, but for some of us that's not helpful). The enclosed instructions were not very helpful, and the on-board touchscreen wanted me to set it up for mobile using my phone, then did not provide the correct QR code or series of numbers for me to get it working. Finally I did a manual driver search using my computer's install-printer settings. Even that was a little more complex than usual because it wanted me to enter the printer's IP address manually; fortunately that number WAS on the little touchscreen, and after that it was smooth sailing.After the minor hiccups of setting it up, it worked fast and extremely well! I needed to print a full-color comic book page onto cardstock right away, and it spat it out in about 10 seconds looking absolutely perfect. I understand I'll run out of toner in about a week if I make that a habit, but it is nice to have that capability when I need it! So far it has printed very crisp, professional looking documents, and the full color prints have been absolutely flawless.It is a little larger than my inkjet (which admittedly is a big, multi-function inkjet) and it is A LOT HEAVIER. So be sure you have a good printer stand for it, because it needs it's own place. I'm not sure I would recommend it to anyone and everyone for home use, as it is a whole lot of printer for just the occasional job. But if you need excellent quality printing and are able to pay for supplies, this is a very solid model."
R1CNBRTS6Y639V,"September 16, 2019",Dave Cunningham,Vine Customer,2,MC3326adwe,N/A,0,0,No,Mediocre office printer,https://www.amazon.com/gp/customer-reviews/R1CNBRTS6Y639V?ie=UTF8&ASIN=B07T5PRRXD,,"The main reasons this Lexmark doesn't get high marks from me: the setup is not as quick and easy as other printers I've had, and the color printing is only mediocre. I sometimes print photos and images on blank DVD disks, and I love that my Canon printer can do that in a very high-quality way. This Lexmark, not so much. Also, it's considerably larger than my Canon.It does spit out pages fairly quickly, about one every 3 seconds, and if you just need black and white document copies, this is a good printer for that. It's really best suited for office work.Another downside is that the toner is quite expensive. I was hoping to find a generic toner that would be compatible, but apparently none such exists yet. I know people who much prefer laser printers to inkjet, and perhaps it will last longer than my Canon inkjet printer -- I have gone through three inkjets in the last eight years -- but I still prefer the nice quality color printing of an inkjet."
R2HD536KQV8I46,"September 13, 2019",Joanne Rhodes,Verified Purchase,1,MC3326adwe,N/A,4,2,No,Most Frustrating Printer Ever,https://www.amazon.com/gp/customer-reviews/R2HD536KQV8I46?ie=UTF8&ASIN=B07T5PRRXD,,"I've set up countless printers and never experienced the difficulty setting up this one. Despite 8 hours of following directions & repeated sequences recommended from Lexmark, this printer finally connected, but displayed a blinkingred light. In the process of following a sequence to eliminate the light, the printer lost its connection to my network...finally repacked and returned... never again, Lexmark!"
RALORZFUCPLOU,"September 6, 2019",Student,Verified Purchase,1,MC3326adwe,N/A,3,1,No,Cannot Pull Out Cartridge Tray,https://www.amazon.com/gp/customer-reviews/RALORZFUCPLOU?ie=UTF8&ASIN=B07T5PRRXD,,This thing is defective - cannot pull out cartridge tray.
R3JP2FS7A5E5HV,"August 25, 2019",D. Matheny,Vine Customer,5,MC3326adwe,N/A,0,0,No,Excellent for SOHO printing/copying,https://www.amazon.com/gp/customer-reviews/R3JP2FS7A5E5HV?ie=UTF8&ASIN=B07T5PRRXD,,"We're using this in the front of our shop for printing invoices and other paperwork. The print quality is great and the copy/scan feature also works well.There is some weirdness around scanning to network locations (like needing to scan using the IP address) - and this printer isn't fast enough to handle high volumes; but, it's perfect for a SOHO environment with light-duty printing requirements.We've used the higher volume Lexmark printers in our office for years, and this is like a smaller/slower version of those larger machines."
R1118Q1N3GU8OY,"October 15, 2019",Christopher Clancy,Verified Purchase,1,B2236dw,N/A,0,0,No,Didn't work,https://www.amazon.com/gp/customer-reviews/R1118Q1N3GU8OY?ie=UTF8&ASIN=B07N23D92N,,Could not get printer to work. Difficult to set up to print from my cell phone.
RNUOK73FF9VJ8,"October 1, 2019",jose,Verified Purchase,1,B2236dw,N/A,0,0,No,there is no cable to connect to my lap top,https://www.amazon.com/gp/customer-reviews/RNUOK73FF9VJ8?ie=UTF8&ASIN=B07N23D92N,,what I didn't like about the printer is that when I turn it on I keep getting a SERVICE PRINT HEAD ERROR 111.30A.so I have not used the printer. I have a cable from my old Lexmark printer but I still can't use the printer because of the error.
R1EY5NWCC83NMN,"September 19, 2019",Bamidele Olaleye,Verified Purchase,5,B2236dw,N/A,0,0,No,Great product,https://www.amazon.com/gp/customer-reviews/R1EY5NWCC83NMN?ie=UTF8&ASIN=B07N23D92N,,Perfect lightweight laser printer. Great print quality. Especially love the WiFi capability.
RBTHRAZ152JT9,"September 10, 2019",Matthew R,Vine Customer,5,B2236dw,N/A,2,0,No,"Fast black and white.  No ink drying issues like inkjet.  Wireless, USB or Ethernet",https://www.amazon.com/gp/customer-reviews/RBTHRAZ152JT9?ie=UTF8&ASIN=B07N23D92N,,"I do like this printer but my out of box experience was not great. I unboxed it and removed the tape from the various locations that are supposed to keep things in place during shipping. I answered a few questions on the little screen like what language do I speak and timezone, etc. Then I adjusted the paper tray to fit Letter size paper. With letter paper, the drawer hangs out of the back of the printer a little. I said to keep the paper size as letter and it said to clear a jam in the back of the printer.Well, I assumed it had to do with the paper tray since that stuck out. It was actually a piece in the door on the back of the printer that was causing the issue. Once I opened that drawer and put the piece in properly, everything went well.I got the driver from the Lexmark website. I plugged it in via ethernet and the IP address conveniently displayed on the screen. I was able to print right away.I have to say that these little printers are pretty impressive these days. I worked on laser printers and even repaired them way back in the HP 4 days. Those printers could not duplex and didn't print anywhere near as fast as these modern laser printers.I think this is a nice desk printer for someone in an office or home office. It is a great little home printer. The biggest thing for me is that it is laser and not inkjet. I have tried to use color inkjets for years. They print nice quality and the color is great. The downside is that I don't print color all that often and when I do print it is almost always black and white. (or black and white would be acceptable at least for my purposes) The ink would always dry up between uses on my inkjet printers and the ink costs more than the printer. (like razors and razor blades)It turns out that toner for this laser is quite expensive and depending on how you order it, it can be close to the price of the printer. (though the price here is very good at the moment at around $100) There are 3 different capacity toners. If you use the Lexmark return program, you save a lot of money. (you give them the empty cartridge back and you save a ton)I'm sure there will be 3rd party toner options at some point but this is what I found on the Lexmark site as far as pricing for the return program toner:Lexmark B221000 Black Return Program Toner CartridgeB221000 1200 $44.99Lexmark B221H00 Black High Yield Return Program Toner CartridgeB221H00 3,000 $79.99Lexmark B221X00 Black Extra High Yield Return Program Toner CartridgeB221X00 6,000 $159.99I only listed the price of the return program toners because the other ones are really expensive and it wouldn't make sense to buy them. (just return it and save a lot) I assume that 3rd party toners will be available at some point and may not require you to return them for a reasonable price.I have no complaints about the printer. It is somewhat compact, quiet and fast. It even prints duplex (2-sided) if you want. I love that it is WiFi capable. I had several old HP printers laying around my house that had good toner in them until fairly recently. I was basically able to print for free. They smelled bad, took up too much space and took forever to warm up.These modern, compact, desktop printers are pretty impressive. I think if you compare the cost of toner for this printer with an inkjet printer, the laser is a little less expensive on paper. In the real world, however, if you have to change your ink cartridges in your inkjet because they dried out, the laser is way less expensive.I do keep a color inkjet around for printing photos. I do not look forward to using it and going through the cleaning cycles and possibly buying ink cartridges when it has sat too long. For most of my printing, this little guy will do what I want."
R3E4SR1S3M306F,"August 6, 2019",D. Michael Elkins,Vine Customer,4,B2236dw,N/A,0,0,No,"Mac users, please set up using a printer cable!",https://www.amazon.com/gp/customer-reviews/R3E4SR1S3M306F?ie=UTF8&ASIN=B07N23D92N,,"Â I spent at least a half hour trying to figure out how to set up this printer to use with my Mac computer and laptop today. Visit the Lexmark website and you'll see a message that makes it appear that there isn't a driver available but then there's also something to download that will download but won't readily open with any application. I then just tried to add the printer using the ""add printer"" command in the system preferences but the computers could not find the printer. I was then about ready to give up when I noticed an option of connecting the printer by using a printer cable, which of course, is never supplied with any printer that you buy. I salvaged one from an old printer, attached it to my computer and the printer and the printer showed up immediately as one of my ""add printer"" options. Once I had added the printer, I was able to disconnect the cable and it printed flawlessly thereafter through my office's wireless network.Something that I found strange was when I tried to load up standard 8x11 copy paper. Although you wouldn't expect it, to load what I consider the standard size paper, you must extend the back of the tray from its normal configuration, which causes the back of the tray to extend out from the back of the printer, as seen in the attached picture. Why?Once I was able to get the printer up and running, I had no problems with it operating smoothly and quickly as can be seen in my video.I am using this printer as a replacement for my workhorse Brother HL-L2370DW, which still works fine but for the annoying warning about me needing to replace parts, even after they have already been replaced. Yes, I have searched online for the fix but the suggested one didn't work. You would think that if a unit is smart enough to know when it is time to replace a part, it should be smart enough to know when that part has been replaced without the owner having to go online to determine how to reset the warning indicator."
R20RGYCO94IM01,"August 5, 2019",Shadez82,Vine Customer,4,B2236dw,N/A,0,0,No,"Really nice laser printer, but lacks instruction",https://www.amazon.com/gp/customer-reviews/R20RGYCO94IM01?ie=UTF8&ASIN=B07N23D92N,,This laser printer is great! First thing I noticed right out of the box is that it is SUPER light. I had no issues removing it from the box and carrying it over. There is a grip on the bottom of the printer so you do not have to worry about it sliding. The printer does lack instructions I feel for setting up. I looked through all the box but there are only warning and a physical setup for the device. One thing about the physical device setup is that you need to make sure to remove all the table and the covers for the toner cartridge. I would recommend that when removing the covers for the toner to do it possibly outside. The reason being is that there is a plastic tab you need to pull and remove. I honestly though I would break it pulling this plastic strip out but it does take a good amount of pull to remove. Do not worry this is something you NEED to remove to bring printing. It will carry about a small amount of toner if you are pulling on it so doing it outside will ensure you do not get toner all over your desk or carpet. Also when remove the paper cover just cut or rip it slowly and remove it. There is a part on the toner you do not want to touch. There is a drive disk if you need it but if you do not have it a simple google of the model will take you to the download page. The paper tray will have not have the paper completely pushed down and that's okay. It will be elevated in the tray. The screen just traditional black and white. There is no color or visual and the controls are fairly easy to navigate once you get use to it. The setup was a bit annoying as it loops for some reason through a lot of the setup. The printer does use a traditional computer plug to power the device and uses a type b usb cable. Be aware that the device does not come with that cable so if you want to do a direct connection you will need to purchase that separately. You can manually set up the wifi on the device itself just be aware you will have to rotate through all of the different characters. I have not had any connection issues and once on the internet network you can easily search for the printer on the network and connect to it. The printer prints super fast. It can shoot out the printout in I would say 1-2 seconds after it is done warming up. You do not have to wait very long to get the print out. It has all the indicator lights to show low on toner or low on paper. It is not a very big printer so you do not have to worry about it taking up too much space. Overall this print is a nice printer to have if you only print in black and white as well as want something that will last you a long time before replacing the toner. It also great to have for a small office as well. The only issue I have is the instructions apart from the physical setup is lacking.
R1NTPHPAPXKOHJ,"July 30, 2019",Lashello,Vine Customer,4,B2236dw,N/A,2,0,No,Lexmark makes good printers.,https://www.amazon.com/gp/customer-reviews/R1NTPHPAPXKOHJ?ie=UTF8&ASIN=B07N23D92N,,"This printer is quiet and durable. It handles a full set of paper. The print quality seems excellent and it was painless to install. The printer software came with it, and it's all just plug and play. I love it when things work the way they're expected. Perfect printer for non-tech savvy. I have this in my office and it makes printing much more straightforward. it can print a stack of 40 pages before you can even blink. in black and white, of course. Although, I wouldn't use this for anything other than text documents. However, the cartridge that is combined barely lasted me 150 prints before it required to be replaced... Don't waste your money on the cartridges, I bought some grey unbranded ones on amazon ""two of them for $40 or so"" and so far they have lasted way longer than the included one, with no loss in quality."
R3UVUX8KYP4R2F,"July 27, 2019",joseph d cook,Verified Purchase,4,B2236dw,N/A,0,0,No,good basic printer,https://www.amazon.com/gp/customer-reviews/R3UVUX8KYP4R2F?ie=UTF8&ASIN=B07N23D92N,,good overal deal
R1CVF8GZAU0PDD,"July 23, 2019",Eric,Vine Customer,5,B2236dw,N/A,0,0,No,Easy to install and print fast,https://www.amazon.com/gp/customer-reviews/R1CVF8GZAU0PDD?ie=UTF8&ASIN=B07N23D92N,,"The printer was delivered in perfect condition. It was very well packaged and had no internal damage. It was really easy to assemble and put all the toner in the place, etc.. The instruction was very easy to follow and I was able to get the printer connected to my network and installed on my Windows 10 computer under 15 minutes. The iCloud accessibility is easy to set up with any smart device, we have used our PC, laptop, and smartphones! The CD for instructions is also a great asset and easy to review and learn about the printer!"
R1Z29LH9VNR1IK,"July 20, 2019",Michelle T,Vine Customer,5,B2236dw,N/A,1,0,No,Lexmark Mobile Assistance App helps with install,https://www.amazon.com/gp/customer-reviews/R1Z29LH9VNR1IK?ie=UTF8&ASIN=B07N23D92N,,"Nice, compact size. Print quality for the price is decent. Setup was easy- basically just pulling the tape off various pieces, plugging in, and installing software. You can install the driver from the provided disk...pro tip: download the â€œLexmark Mobile Assistanceâ€ app on your phone. It will quickly walk you through connecting your printer to your WiFi network via your phone (so make sure your phone is hooked up to your WiFi network too.) this made installing the driver a breeze. Total setup for me was done in about 10 mins.I dislike that the paper tray pushes out the back of the printer as pictured, but itâ€™s easy to live with.For a quality budget printer, I give this 5 stars."
R2PAKWPINHRRKV,"September 5, 2019",Annie,Vine Customer,2,C3326dw,N/A,3,2,No,Expensive replacement cartridges...,https://www.amazon.com/gp/customer-reviews/R2PAKWPINHRRKV?ie=UTF8&ASIN=B07T3H979V,,"I have always been fond of Lexmark printers and was excited to have one to replace my quickly dying other brand printer. Over the last few years printer have gone down in price and up in quality. This is a laser printer. The tray will up to to 250 pages, plus there is a single sheet feeder. The printer is wireless. It can print up to 26 pages per minute.Setup is fast and easy. Lexmark has a toner cartridge recycling. My major criticism is the cost of the replacement cartridges."
R2FJDLSYBEKEKM,"August 29, 2019",L. South,Vine Customer,5,C3326dw,N/A,0,0,No,Fastest printer I've ever owned.,https://www.amazon.com/gp/customer-reviews/R2FJDLSYBEKEKM?ie=UTF8&ASIN=B07T3H979V,,"This is by far the fastest printer I've ever owned. Easy to set up, produces good quality printing and has worked flawlessly."
R3Q9QR20MJG8SF,"August 26, 2019",V.E.,Vine Customer,5,C3326dw,N/A,0,0,No,Great printer,https://www.amazon.com/gp/customer-reviews/R3Q9QR20MJG8SF?ie=UTF8&ASIN=B07T3H979V,,"Great printer, easy to setup and easy to use. Copies are clear and crisp. Little bit noisy in operation, but overall a great printer, solid machine that will last. I will not be using the app, so canâ€™t say if that works well or not."
R1DNKBQT2AGWEC,"August 17, 2019",TheaCecelia,Vine Customer,5,C3326dw,N/A,0,0,No,Great Home Office Color Laser Printer!,https://www.amazon.com/gp/customer-reviews/R1DNKBQT2AGWEC?ie=UTF8&ASIN=B07T3H979V,,This printer was simple to set up. It took me about 20 minutes to unbox and get it printing. No issues with wireless set up either. Iâ€™m really pleased with the performance and quality. Itâ€™s really nice to get your printing needs met so quickly! Iâ€™ve not experienced any glitches or issues with the printer and am enjoying the App with my iPhone. Itâ€™s incredibly convenient to be able to print from various devices!This is my first Lexmark printer and Iâ€™m impressed!
R1ABNJ3ZVRD44G,"August 10, 2019",Stephanie,Vine Customer,4,C3326dw,N/A,1,0,No,"Hefty, straightforward, simple. Print quality ok.",https://www.amazon.com/gp/customer-reviews/R1ABNJ3ZVRD44G?ie=UTF8&ASIN=B07T3H979V,,"This printer is much heavier than I was expecting. Iâ€™m not sure where all the weight is, as the machine itself is very simple, with no extra bells or whistles. No copying, no scanning, just printing.Setup was very painless. The instructions are very minimal (all pictures): basically, remove the packing tape and safety covers on the toner, install the software, print. I used the cd to install drivers and software and everything went smoothly and quickly.Printing was fast and just a bit noisy. The fan is loud, but it wasnâ€™t an issue for me. Noise could be an issue if you were printing hundreds of pages at a time.Print quality was a little less than I expected. I donâ€™t print much color, but I have some business documents that need occasional color, and I have to say that this printer didnâ€™t wow me. Itâ€™s ok...but, if I was seriously looking to impress, I might look for something a bit sharper and cleaner.Overall, itâ€™s a no-nonsense machine that does a quick and fairly nice job of my color printing needs."
R3U773FOUSF2EC,"August 6, 2019",G REAL REVIEWS,Vine Customer,5,C3326dw,N/A,0,0,No,Love this printer!!,https://www.amazon.com/gp/customer-reviews/R3U773FOUSF2EC?ie=UTF8&ASIN=B07T3H979V,,"It was love at first site. I swear trying to find a decent printer is sometimes next to impossible.Set up was upset easy. WiFi, and through the app. Too about 5 minutes and I was on my happy printing way. So happy to finally have a printer that prints the first time I ask it to, and is SO FAST!!"
R11NQJ4LRD11A2,"August 5, 2019",IHeartAmazon,Vine Customer,5,C3326dw,N/A,0,1,No,This thing is FAST!!!,https://www.amazon.com/gp/customer-reviews/R11NQJ4LRD11A2?ie=UTF8&ASIN=B07T3H979V,,"Upgrading my husbands home office so he can work from home a day or two a week, and this was a step in the right direction! This baby prints super fast!! I mean it spits it out! It's a bit louder than I am used to, but it is what it is. Set up was pretty straight forward as with many other printers we've used. Install the drive, connect to the network and so forth. It also prints double sided if needed so that saves paper for us, which I like. Since he will be printing a lot of memos and printed direction info and things like that. This is quite the beast of a printer, and I can see it really outlasting all of our previous ones. So glad I decided to pick this one up and give it a try! I will post pictures as soon as I get it in it's permanent home ( we are packing up for a move) I will also post a video of it in use!"
