LXKresponded,body,codename,comments,date,id,model,program,purchaseType,reply,stars,title,upvotes,url,username
No,"I am using this to replace a Brother laser printer (NO COLOR, NO WIFI) that I have used for 6 years and it was still going strong.So far I don’t regret the upgrade to this Lexmark. While it’s no faster to print than the Brother, it isn’t slower, and is MUCH quieter, which I like in my office setting. Print quality on the whole is excellent. As far as the color printing goes (which I don’t do much of), it looks good, but not great. You won’t confuse it for a photo printer, nor is it intended to be. For color documents, it’s MINT!What I don’t like...well, set up was sort of annoying. The machine prompts you to download the app on your phone, which I did. No matter what I couldn’t get the thing to connect. So I wound up backing out of the set up and doing it manually from the printer. Took forever punching in my cryptic WiFi password with no keyboard. After that, I did get a strange error about the Cyan cartridge. I cleared it and it hasn’t come back, so we will see.Overall it’s well made, has a good “heft” to it. It occupies only about the same space as my old B&W printer, which is impressive. Servicing and toner replacement is easy. It has a lot going for it, and so far I am thrilled with it!***3+ month update**** printer has been perfect. I use it every day and have not had a single paper jam or any other issues. This is a nice printer! Continues to impress!!",Bluering,0,"July 31, 2019",R1I0G70F6ZF1SI,C3224dw,Bluering/Lionfish (BRLF),Vine Customer,,5,"Well, it has a lot to live up to. So far so good...",10,https://www.amazon.com/gp/customer-reviews/R1I0G70F6ZF1SI?ie=UTF8&ASIN=B07T6PGM4J,Dale
No,"Printers can be hit-and-miss when it comes to setting them up and this one is no different. Upon powering up, the screen prompts you to approve several settings before eventually reaching a point where you'll continue via Lexmark's mobile app, or, continue with setting up on the printer directly. I opted to go to mobile app route since I'd be connecting to my wi-fi network and entering a password on the printer's minimalist screen would be a pain.On the mobile app, you'll be prompted to connect to a wi-fi signal being output by the printer, and from there you'll tell it what wi-fi network you want IT to connect to, along with the password, and you're set!...or rather...you should be. For me, everything appeared to be setup just fine, but for some reason, I still had to manually select a network and enter the password on the printer itself. Not really sure what went wrong, but that was a little annoying. Once connected, simply install the printer's driver software from the included disc (or download from Lexmark site) and you should be set.Besides that minor inconvenience, printing quality is perfect, and fast. It goes to sleep automatically after a period of not being used, and it doesn't make any noise or mechanical adjustments when being turned on/off, or when sleeping, or being woken. Other printers I've had all seem to make noise when doing this and this sometimes occurred in the middle of the night too, so it'd be a bit startling, but this Lexmark is perfectly quiet in this respect.Overall, really nice printer that does its job well.",Bluering,0,"July 29, 2019",R31BL20KZA0QSQ,C3224dw,Bluering/Lionfish (BRLF),Vine Customer,,5,A little clunky setup at first but great quality prints,3,https://www.amazon.com/gp/customer-reviews/R31BL20KZA0QSQ?ie=UTF8&ASIN=B07T6PGM4J,Ugh
No,"Below are my thoughts/observations on the Lexmark C3224dw Color Laser Printer. Some pictures are also included.Setup- the printer box had illustrations on top showing how to remove the printer from the box. I found that helpful and accurate in how best to begin the setup process.- Inside, a two sided sheet showed additional instructions for removing the tape, setting up the toner cartridges (which were already installed) and adding paper- It came with an installation CD for use in setting the printer up as locally attached to a PC. - You will need to supply your own USB printer cord and connect it to the printer and PC. - Turn on the printer; load the CD in your computer’s drive and the install process will begin automatically (I installed it on a Windows 10 desktop). In a couple of minutes, my PC sent a pop-up message that it was done.- While the CD was installing the printer drivers, etc. to my PC, the printer itself also displayed messages on its display screen: - First, it asked if I wanted to setup the phone app. I declined this since I did not want another phone app. - Next, it walked me through the steps to set it up on my home WIFI. This was pretty easy to do but unavoidably repetitive. I.e., if your WIFI name is “KatManDu-74”, you will have to enter each upper/lowercase letter, character or number by repeatedly pressing an arrow key for each one then hitting “OK”. Not difficult to do but boring. This, of course, took longer to complete than the automated process with the CD.Output QualtiyIt is excellent. I printed multiple photographs and they looked great and also printed some test prints and plain text documents that also looked really good.Printing Through WIFIWithout installing any apps to my iPhone or iPad, I was able to print multiple photos even though the WIF router was upstairs and I was in the basement sitting next to the printer. This means the image was transmitted through the floor/walls to the router and back through the floor/walls to the printer without issue.Overall ImpressionsAs stated earlier, I did not install or test any Lexmark printing apps (for the phone or PC) but do not think they are needed for wireless/remote printing. They may have other features (low toner warnings, etc.) that you may desire so, that is a choice you must make..It is quiet, and gives excellent quality output whether locally attached to your PC or sitting as a standalone device on your WIFI. You also have the option of connecting it to your network using an Ethernet cable but I did not test that since making the WIFI connection was so simple.I am very happy with the Lexmark C224DW printer.",Bluering,0,"July 28, 2019",RYLHERBWWYBU8,C3224dw,Bluering/Lionfish (BRLF),Vine Customer,,5,Excellent Output; Easy Local or WIFI Setup,19,https://www.amazon.com/gp/customer-reviews/RYLHERBWWYBU8?ie=UTF8&ASIN=B07T6PGM4J,MWCraft
No,I sell online and this printer is excellent for shipping labels. It was very fast and got my job done in five minutes. The printer also synced with my windows system fast and simply. The printer how ever is very heavy and I needed help carrying it.,Bluering,0,"July 27, 2019",R3RBOCXG0HEB2C,C3224dw,Bluering/Lionfish (BRLF),Vine Customer,,4,I sell online and this is excellent for shipping labels.,1,https://www.amazon.com/gp/customer-reviews/R3RBOCXG0HEB2C?ie=UTF8&ASIN=B07T6PGM4J,louise
No,"My first thought with this printer was how heavy it is! It was very easy to unpack it from the box, but no USB cable was included with the printer. I know it's wireless, but I wanted to connect it to my desktop with a USB cable so I wish that it would have been included. It was really slow to set up through the touch screen on the printer wirelessly. I should have used the app. The Google Cloud print worked really well though. The printer is very loud, but the picture quality is beautiful. I don't print much so I think this printer is going to work out great for me.",Bluering,0,"October 5, 2019",R2KU42YIEKGAWD,C3224dw,Bluering/Lionfish (BRLF),Vine Customer,,4,"Beautiful picture quality, but use the app to set it up",1,https://www.amazon.com/gp/customer-reviews/R2KU42YIEKGAWD?ie=UTF8&ASIN=B07T6PGM4J,Sharon
No,"Its awful expensive, hard to set up and use, but seems easy to use.",Bluering,0,"October 4, 2019",RKUOWLR5BMTT0,C3224dw,Bluering/Lionfish (BRLF),Verified Purchase,,4,Its quick,0,https://www.amazon.com/gp/customer-reviews/RKUOWLR5BMTT0?ie=UTF8&ASIN=B07T6PGM4J,jjeff68
No,"Almost didn't buy this based on all the 1-Star reviews, but realized they were mostly wireless connectivity issues. Having printers drop wireless connections is a Home WiFi given and is easily corrected by assigning an IP address to your printers. This is a bit of an advanced WiFi management issue, but the best thing you can ever do for printers, as well as any complex, LAN-connected items. It only takes a minute once you know how to do.Hooked it up to my WiFi, reserved and assigned the IP address that it took. Real nice that it's displayed on the screen, and off we went. Yeah, it's a little slow to first page print, but no rush.We're low volume users and I'm tired of inkjets' print heads gumming up. This should be the cure to that.",Bluering,1,"September 24, 2019",R33LQREBKHEA7E,C3224dw,Bluering/Lionfish (BRLF),Verified Purchase,,4,"Don't Let The Negative Reviews Stop You, A Decent, Low-Priced Laserjet",123,https://www.amazon.com/gp/customer-reviews/R33LQREBKHEA7E?ie=UTF8&ASIN=B07T6PGM4J,NaClH20
No,"Easy to set up, great quality prints",Bluering,0,"September 23, 2019",R2W6DJRK1W6HNG,C3224dw,Bluering/Lionfish (BRLF),Verified Purchase,,5,Easy,2,https://www.amazon.com/gp/customer-reviews/R2W6DJRK1W6HNG?ie=UTF8&ASIN=B07T6PGM4J,Mandy Casey
No,"0 star.....after it arrived it would not detect our router...... 3 apple computers, our previous printer and 2 Samsung phones talk to the router just fine...... then the printer was connected by wire to an APPLE MINI-MAC AND A LAP TOP, no response from the printer or computers............ we had to package it back up and haul it to the UPS store , all 41.75 pounds . We will buy a Canon or HP",Bluering,1,"September 11, 2019",R1MC724DK03CZE,C3224dw,Bluering/Lionfish (BRLF),Verified Purchase,,1,"0 star, would not work",17,https://www.amazon.com/gp/customer-reviews/R1MC724DK03CZE?ie=UTF8&ASIN=B07T6PGM4J,gene alderson
No," The Good:-Compact design (fits in the same space as my older smaller inkjet printer)-Great print quality-Fast printing-Easy set up (just have to download the Lexmark iOS app)-Fairly quiet operationThe Bad:-No scanning functionality (but compact design), I typically scan with my phone anyways and just print from my phoneThe Bottom Line:We are using this as our primary printer in the house and it’s great since now we don’t have to worry about our inkjet constantly drying up. The print quality is superb and it prints double sided to save paper. The printer prints fairly quietly and quickly. The best part of this color laser printer is it’s compact design. It fits in the same spot as our smaller inkjet printer. The set up was very easy as you just download the Lexmark iOS app (I use an iPhone 8 Plus) and then you just connect to your WiFi and you’re basically set up and ready for printing. Overall, I would recommend this printer.*If you found my review helpful, please let Amazon know by clicking the helpful button below!**Disclosure: I received a sample product from the Amazon Vine program for an honest and unbiased review.",Bluering,1,"August 29, 2019",RU276IQ4QM2LV,C3224dw,Bluering/Lionfish (BRLF),Vine Customer,,5,Need a compact color laser printer with great print quality and easy set up?,13,https://www.amazon.com/gp/customer-reviews/RU276IQ4QM2LV?ie=UTF8&ASIN=B07T6PGM4J,Hoppaguy
No,it does what its supposed to and makes the pictures pop on the right paper ...setup was interesting I tried to do it via wifi on my phone to a regular router it would connect but it wouldnt do the final setup ... took a few swings at it even tried manual on the menu input (PITA ) but wouldnt work so I reverted to ethernet cable direct popped right up and all was wellsetup from the phone via the lexmark app worked fine after that and even found it on the network without the IPprinted nice and quick to spool up and kick the first page ... it not super loud but I wouldnt print in the middle of the night unless you had to kind dealenjoy this review I will use this for school for my daughters homework and light printing around the house,Bluering,0,"August 27, 2019",R2YVBV5GQ5HSGC,C3224dw,Bluering/Lionfish (BRLF),Vine Customer,,5,nice printer .... nice prints,1,https://www.amazon.com/gp/customer-reviews/R2YVBV5GQ5HSGC?ie=UTF8&ASIN=B07T6PGM4J,KaT
Yes,"I selected 1 star because it won't let me select negative stars. I'm not a person who writes reviews, ever. I'm a reasonable person who understands you get what you pay for. I also understand this isn't and wasn't designed to be a ""great printer."" But, this is the biggest POS I've ever purchased. Not exaggerating at all, if I were to print something 15 times, 13 times it crumples the hell out of the paper and doesn't print properly, 1 of 15 times it jams and 1 of 15 times it prints OK, but at a slight angle. Do not buy this thing.",Bluering,1,"August 27, 2019",R2SNXJQ1ZBFXRQ,C3224dw,Bluering/Lionfish (BRLF),Verified Purchase,"Thank you for purchasing and reviewing your Lexmark C3224dw. We are sorry to hear about the issue you’re having with your printer. The paper jamming you reference is unexpected behavior and we would be happy to help you sort it out. If you could, please contact Lexmark Technical Support at 1-800-Lexmark so we can help you get up and running as intended. We look forward to hearing from you soon.",1,This printer is junk,26,https://www.amazon.com/gp/customer-reviews/R2SNXJQ1ZBFXRQ?ie=UTF8&ASIN=B07T6PGM4J,Andrew D.
No,"Pros: Prints two sided quickly with ""clean"" copiesCons:It is basically at the same price point as the 3 in 1 HP printer, scanner, and fax I have at my office.Same size and price, but without the ability to scan or fax. I can live without the ability to fax, but the scanner would require buying and finding a place for a scanner in addition to the printer.It says it only requires one cartridge for ink replacement. It requires 5 at $125 a piece. ($625 total)I prefer the HP printer I have at my office.",Bluering,0,"August 27, 2019",RWRG3SB0FBNAQ,C3224dw,Bluering/Lionfish (BRLF),Vine Customer,,2,"requires 5 ink  cartridges, not one...",2,https://www.amazon.com/gp/customer-reviews/RWRG3SB0FBNAQ?ie=UTF8&ASIN=B07T6PGM4J,dsjsws
No,"This printer has been a huge upgrade for me. I used to have a small HP printer which was ok for my needs or what I thought it was enough for my need. See I have a small business is home based and I’ve never thought of buying a business style printer and Man, was I wrong! First, I was shocked at how compact this Lexmark printer is and was so surprised at the same time how powerful and fast it was, this thing is a workhorse. Specially I can send anything via WIFI and no more of running cables and tripping over them.Setup was very easy. From unpacking it, to printing my first page was about 5-10 minutes. I was also surprised at how fast it prints. The print quality was sharp, bold and clear. My only struggle was when I tried to switch from plain paper to labels, the label paper is slick on the back side and the first two sheets I tried did not want to get picked up by the coil. So, I had to take out the labels and air the sheets. What I’ve noticed is that It really helps if you keep the tray full. After doing this, printing has been a breeze.Overall, this printer has changed my mind 180 degree in favor of having a business printer. I am very happy with it, especially the speed. highly recommended.",Bluering,0,"August 17, 2019",R2EF9KBLG7U2HJ,C3224dw,Bluering/Lionfish (BRLF),Vine Customer,,5,Workhorse,0,https://www.amazon.com/gp/customer-reviews/R2EF9KBLG7U2HJ?ie=UTF8&ASIN=B07T6PGM4J,Lashello
No,"Unpacking & setting up on wifi quick, instructions after that seem limited. Lexmark mobile print app, does not seem to handle documents. iPhone was able to print documents once printer was setup in air print, similarly on Android devices had to add printer to Google cloud print (little issue with expired certificates, had to disable some security features).Once configured seems to have no issues printing from mobile devices.",Bluering,0,"December 8, 2019",R1X7EJRL9YRPOW,C3224dw,Bluering/Lionfish (BRLF),Verified Purchase,,4,"Good printer for the $, mobile printing via iOS & Android requires 3rd party utilities.",1,https://www.amazon.com/gp/customer-reviews/R1X7EJRL9YRPOW?ie=UTF8&ASIN=B07T6PGM4J,MadMonk
No,"I took a chance on this because it was cheap. Fresh out of the box it doesn't work. Got the same error another user mentioned here, ""remove cartridge packaging"". There is no packaging to remove because I followed the instructions and removed it. The real issue here is a piece of junk product that should be removed from Amazon. Now I have to deal with tech support on a brand new printer. *****DO NOT BUY",Bluering,0,"December 7, 2019",R81KVXOGIIEYP,C3224dw,Bluering/Lionfish (BRLF),Verified Purchase,,1,Beware,8,https://www.amazon.com/gp/customer-reviews/R81KVXOGIIEYP?ie=UTF8&ASIN=B07T6PGM4J,Andrew Sheffield
No,I was looking for a new printer didn't think i could afford a color laser printer when i came across the Lexmark it was just what i was looking for and the price was great .Definitely would recommend it to a friend,Bluering,0,"December 5, 2019",R3F8UV7DQYI603,C3224dw,Bluering/Lionfish (BRLF),Verified Purchase,,5,Great laser printer for the price,1,https://www.amazon.com/gp/customer-reviews/R3F8UV7DQYI603?ie=UTF8&ASIN=B07T6PGM4J,David Griffith
No,"Was really watching this to see if it was going to work out, purchased it and LOVE it!! Prints great great quality and you cannot beat the price. Came on time and worked perfectly on setup!",Bluering,0,"December 3, 2019",R2E8F2ZKGV2UBM,C3224dw,Bluering/Lionfish (BRLF),Verified Purchase,,5,Worth It!,0,https://www.amazon.com/gp/customer-reviews/R2E8F2ZKGV2UBM?ie=UTF8&ASIN=B07T6PGM4J,K. Smith
No,Very fast shipping great value,Bluering,0,"November 25, 2019",R1NH0FDA3VMQNA,C3224dw,Bluering/Lionfish (BRLF),Verified Purchase,,5,Exactly what I was looking for thank you,0,https://www.amazon.com/gp/customer-reviews/R1NH0FDA3VMQNA?ie=UTF8&ASIN=B07T6PGM4J,glenda f
Yes,"Arrived with one day shipping, color me impressed.Well packaged, and the shipping box was pristine, all items included (just a manual, power cable and a disk for drivers). The packing foam was secure and nothing out of place.Followed the steps to a T and when I powered it on, I was greeted with this error:""remove cartridge package""I triple checked myself and I had removed everything it stated. Nothing cleared this. The Lexmark support website said contact them. This is brand new. I shouldn't have to.Requesting a refund. This thing is a heap of electronic crap.",Bluering,1,"November 22, 2019",R28WPQ3XFY8F0O,C3224dw,Bluering/Lionfish (BRLF),Verified Purchase,"Thank you for purchasing the Lexmark C3224. We are sorry to hear that the device was defective out of the box as that is not the expected quality of our devices. We would be happy to replace this device. If you would like to proceed with replacing the printer, please contact Lexmark support at 1-800-Lexmark (1-800-539-6275). We apologize for the inconvenience.",1,Dead On Arrival,5,https://www.amazon.com/gp/customer-reviews/R28WPQ3XFY8F0O?ie=UTF8&ASIN=B07T6PGM4J,Brittany
No,Great product for the price if you do not have lots of color printing volume. Set up took about 5 minutes including getting it out of the box. Plugged it right into the network and all was fine.,Bluering,0,"November 22, 2019",R3VQ0NPFBT69A0,C3224dw,Bluering/Lionfish (BRLF),Verified Purchase,,5,Easy Set Up,0,https://www.amazon.com/gp/customer-reviews/R3VQ0NPFBT69A0?ie=UTF8&ASIN=B07T6PGM4J,joseph c kinsey
No,sometimes i need to reset the ip address.,Bluering,0,"November 13, 2019",R1R97FQUKNLU1I,C3224dw,Bluering/Lionfish (BRLF),Verified Purchase,,5,works in my tool box.,0,https://www.amazon.com/gp/customer-reviews/R1R97FQUKNLU1I?ie=UTF8&ASIN=B07T6PGM4J,Amazon Customer
No,"Bought this printer to replace my old inkjet printer. The software instructions are so veage it's amazing anyone could connect to their computer much less network. And once it was connect, kept getting Error messages that it was out of Magenta toner. Brand new and already asking for toner to be replaced. what a load of crap. Day2 working with tech support. OMG what a trip.",Bluering,0,"December 23, 2019",R21I0LPZU7UB39,C3224dw,Bluering/Lionfish (BRLF),Verified Purchase,,1,Don't waste your money.,1,https://www.amazon.com/gp/customer-reviews/R21I0LPZU7UB39?ie=UTF8&ASIN=B07T6PGM4J,gregory
No,"The printer came perfectly, set up only took about 5 minutes, I didn’t open the package till the next day , I wish I would have opened it sooner , so anyway as I’m setting up my app to print wirelessly to the printer . I press print , it’s loading ... I waited and waited and waited , nothing ! so I canceled and thought maybe it’s because it’s the printers first print . NOPE ! I waited 15 minutes while it stated it was “loading” nothing . I’ve began my return as of right now I’m really upset . I run an at home BUISNESS and this is very disappointing. I was planning on using this right before Christmas considering it came 3 days before and I open it two days before and it’s a piece of CRAP ! don’t listen to the good reviews like I did and say “hey let’s give it a chance” NO don’t do it you will be dissatisfied completely!",Bluering,0,"December 23, 2019",R3B2I6TKIGQNAU,C3224dw,Bluering/Lionfish (BRLF),Verified Purchase,,4,don’t chance it,0,https://www.amazon.com/gp/customer-reviews/R3B2I6TKIGQNAU?ie=UTF8&ASIN=B07T6PGM4J,Monique
No,I paid for a laser color printer but it was always in sleep mode and the ink ran out so fast when I did use it. Also to replace the inkit would cost more than just buying a new printer.Very disappointing to me and cost my company money and time.I sent product back and was never refunded like promised,Bluering,0,"December 22, 2019",R3NBZQNRW7JOIB,C3224dw,Bluering/Lionfish (BRLF),Verified Purchase,,1,Ink cost more than printer,2,https://www.amazon.com/gp/customer-reviews/R3NBZQNRW7JOIB?ie=UTF8&ASIN=B07T6PGM4J,albert plante jr
No,Works as advertised. Pretty easy to setup through the app. Print quality is quite decent. Value is ridiculously high for the money spent! Not sure how much replacement toner's going to cost - Maybe that's where the catch is?! I'm quite happy with this purchase so far.,Bluering,0,"December 21, 2019",RYL17HVTSUTCG,C3224dw,Bluering/Lionfish (BRLF),Verified Purchase,,4,No Fuss,0,https://www.amazon.com/gp/customer-reviews/RYL17HVTSUTCG?ie=UTF8&ASIN=B07T6PGM4J,Arun Kumar
No,"I was able to wirelessly connect my Android phone using the Google Cloud Print app which is a great feature. While I love the quality pictures this printer puts out and the sharpness of my documents, I was astonished when I found how much a new set of Cartridges cost...double the price of the printer !!Hopefully the Toner Cartridges last a real long time.",Bluering,0,"December 21, 2019",R2R8VZAOURKTJT,C3224dw,Bluering/Lionfish (BRLF),Vine Customer,,3,Laser Quality wireless printing,1,https://www.amazon.com/gp/customer-reviews/R2R8VZAOURKTJT?ie=UTF8&ASIN=B07T6PGM4J,Brian J. Fitzpatrick
No,"Lexmark Printer ReviewIf you found this printer difficult to install, then perhaps you are too stupid to own one. It took me longer to take it out of the box than to set it up. I did not use the app, I just plugged it in and used the printer display panel. Took less than 10 minutes from start to finish. I do recommend updating the firmware right after setting it up. It still blows my mind that I am able to buy an excellent quality laser COLOR printer at this price.Print quality is very good. Color saturation and coverage is uniform and rich. I read reviews that complained about how noisy the printer is. That has not been my experience. I only print wireless from Mac, iPhone and Windows without any connectivity problems.I had one problem. Out of the box the printer was printing a series of dots lined vertically 1/2 inch from the right edge, spaced exactly one inch apart on every page. I called Lexmark support who quickly had me run printer diagnostics (again, from the printer display panel). He determined that the problem was caused by the black toner cartridge. He shipped me a new cartridge (full size, not the starter one!), which solved the problem. While it was disappointing to have a problem like this on a brand new printer, Lexmark made up for it. I hope the printer will last for at least 3-4 years, but only time will tell.",Bluering,0,"December 18, 2019",R2XNDMPRWETDW3,C3224dw,Bluering/Lionfish (BRLF),Verified Purchase,,4,Excellent value for the money,1,https://www.amazon.com/gp/customer-reviews/R2XNDMPRWETDW3?ie=UTF8&ASIN=B07T6PGM4J,Miles
No,I was very skeptical based on the price but so far this is a solid printer. WiFi connectivity is solid and print quality is top notch. Printing from computers and mobile devices is really easy. Setup was simple. Only time will tell but I have to say that I am very impressed with this printer.,Bluering,0,"December 18, 2019",REJAGOVNEV2L0,C3224dw,Bluering/Lionfish (BRLF),Verified Purchase,,5,Great value,0,https://www.amazon.com/gp/customer-reviews/REJAGOVNEV2L0?ie=UTF8&ASIN=B07T6PGM4J,Miggo
No,i like it,Bluering,0,"December 17, 2019",R334D0Q03YHCAS,C3224dw,Bluering/Lionfish (BRLF),Verified Purchase,,5,it prints,0,https://www.amazon.com/gp/customer-reviews/R334D0Q03YHCAS?ie=UTF8&ASIN=B07T6PGM4J,gerald l. ingram
No,"Bought this on a whim, forgot to check if Apple compatible. It’s not described as such online. However, with some research I was able to get it to work with my network at home and print from my Apple computers and my iPhone!! We are extremely satisfied!",Bluering,0,"December 16, 2019",R29OMQS6SHFBMJ,C3224dw,Bluering/Lionfish (BRLF),Verified Purchase,,5,Great price and works with my Apple through the network!,0,https://www.amazon.com/gp/customer-reviews/R29OMQS6SHFBMJ?ie=UTF8&ASIN=B07T6PGM4J,Craig Jones
