LXKresponded,body,codename,comments,date,id,model,program,purchaseType,reply,stars,title,upvotes,url,username
No,"UPDATE 3.21.20I went to print on the printer for the second time since printing after set up the first day I opened this printer. I saw the same problem as I did with my previous printer. The print quality is splotchy and blurry. Part of the page didn't even print. I tried darkening the toner in the settings - same issue, no difference. I tried doing a test print - even the test print was splotchy and not clear but the very last page said no issues with cartridge. Amazon customer service said try replacing the toner (which would have cost me HUNDREDS of dollars) which was ridiculous. I am still on the hunt for just a decent printer...I am starting to question if there are any good printers out there any more.I tried another brand before this and was an awful experience printing and trying to return it. I researched and decided to go with this laser printer, and at this price point, I am shocked that the print is THIS clean and sharp. The printer is a bit heavy (~30 lbs?) and large. The set up is pretty easy - I did NOT set up through the app, I did it directly on the printer and got a bit frustrated trying to scroll type my way through my wifi password one letter at a time, but was ready to go immediately after I connected. Then I added the printer on the computer and was printing within a minute. I have also added the app on my phone but have yet to try and print off the app.The only thing I am a bit disappointed by is the darkening of colors when I print in color. Beige turns into a greenish brown, the light pink turns into a muted, darker pink. I will be mindful when printing my own creations to pick lighter colors, but am a bit puzzled by this. Not enough to send back because the printer is so quick and sharp, but a bit annoyed my colors on the screen won't come out on the page exactly. I hope this review helps someone.",Bluering,0,"March 9, 2020",R2JVYG5FC41HPF,C3224dw,Bluering/Lionfish (BRLF),Verified Purchase,,1,NOPE! STILL ON THE HUNT...,2,https://www.amazon.com/gp/customer-reviews/R2JVYG5FC41HPF?ie=UTF8&ASIN=B07T6PGM4J,pandafam
Yes,Terrible terrible quality. Worst than my bubble jet printer.,Bluering,1,"March 6, 2020",R8FYQ609BWVY6,C3224dw,Bluering/Lionfish (BRLF),Verified Purchase,"Lexmark products are designed for reliability and consistent output quality, so we're sorry to hear you have had issues with this device. If you are reading this message within the Amazon-allowed return window, we recommend you initiate an Amazon return and request a replacement. If you are reading this message after the Amazon product-return window has closed, please call 1-800-LEXMARK (1-800-539-6275) Monday-Friday 8:00am to 9:00pm EST for further assistance.",1,Avoid,0,https://www.amazon.com/gp/customer-reviews/R8FYQ609BWVY6?ie=UTF8&ASIN=B07T6PGM4J,Avoid
No,DO NOT buy this printer! I spent 2 1/2 hours attempting to get it to connect wirelessly. It would work intermittently but would not stay connected and I have outstanding WiFi speed & connection strength.I tried to call customer service and waited 1 hour on hold.If you are an IT guy you MIGHT be able to get this to work but for the average Joe - forget it!,Bluering,0,"March 5, 2020",R1V04ABSSB750R,C3224dw,Bluering/Lionfish (BRLF),Verified Purchase,,1,Don’t Buy - WIFI Doesn’t Connect - Be ware!!,1,https://www.amazon.com/gp/customer-reviews/R1V04ABSSB750R?ie=UTF8&ASIN=B07T6PGM4J,Topcop
Yes,"Out of the box this wouldn't work with my wi-fi connection that all my other devices work with. I ended up having to run a 20 foot USB cable to it and it still never worked. Just printed page after page of random letters, numbers, and symbols. No response on the front panel, cant even turn it off without unplugging it. Downloaded all drivers for it and no difference. Waited over an hour on the phone for technical support on multiple occasions before giving up. Lexmark chat tech support doesn't even load when you try and use it. It just says there is an error with the application. I have about 6 hours into this thing and its never worked. Don't waste your time.",Bluering,1,"March 4, 2020",R1HTSK6SKZWX1C,C3224dw,Bluering/Lionfish (BRLF),Verified Purchase,Thank you for this feedback. Lexmark strives to deliver quality products that are easy to use and we are disappointed we did not deliver in this case. Lexmark support calls are typically answered in under a minute when you call 1-800-LEXMARK (1-800-539-6275) from Monday-Friday 8:00am to 9:00pm EST. I hope you will give us another chance to help resolve the Wi-Fi and other issues you are having with your C3224 printer. ,1,"Garbage product, garbage tech support.",0,https://www.amazon.com/gp/customer-reviews/R1HTSK6SKZWX1C?ie=UTF8&ASIN=B07T6PGM4J,Smoke92
Yes,"Color didn't work well out of the box, out-of-memory errors trying to print a single page document, and the whole thing stopped working just over 2 months after delivery. For the price I wasn't expecting much, but this printer just isn't fit for any use. I got about five weeks of printing b&w documents out of it at a rate of 5-10 pages per day, 5 days per week. Very disappointing, and a waste of time, money and energy.",Bluering,1,"March 2, 2020",R3HKMNDZ0EAS3X,C3224dw,Bluering/Lionfish (BRLF),Verified Purchase,"Hi CJ, Thank you for this review. We strive to delivery high quality and reliable products and hate to hear about the problems you experienced with your C3224 printer. The behavior you have outlined is not expected; however, it sounds like you are still in the warranty period.  I recommend calling 1-800-LEXMARK (1-800-539-6275) Monday-Friday 8:00am to 9:00pm EST and selecting the option for technical support so we can help to get you going again.",1,Junk,0,https://www.amazon.com/gp/customer-reviews/R3HKMNDZ0EAS3X?ie=UTF8&ASIN=B07T6PGM4J,CJ
No,"So far this has been an excellent printer. It does have a little troubled duplexing card stock, but at this price point I'll manually flip the page over. Only the second day, so I'll revisit this on day 30",Bluering,0,"February 28, 2020",R1RN4SV604B4A2,C3224dw,Bluering/Lionfish (BRLF),Verified Purchase,,5,So far so good,0,https://www.amazon.com/gp/customer-reviews/R1RN4SV604B4A2?ie=UTF8&ASIN=B07T6PGM4J,Cynthia Tuel
No,Wonderful upgrade from our (very) old printer and just what we needed. The only thing that I am kind of disappointed about is that duplex printing seems to be for letter paper only.,Bluering,0,"February 25, 2020",R7F441SBI1GQC,C3224dw,Bluering/Lionfish (BRLF),Verified Purchase,,5,prints cleanly and quickly,0,https://www.amazon.com/gp/customer-reviews/R7F441SBI1GQC?ie=UTF8&ASIN=B07T6PGM4J,Winona
Yes,"Arrives with the message ""Waste Toner bottle nearly full"". First time I turned it on- out of the box. I'm wondering if I have been sold a used product.",Bluering,1,"April 5, 2020",R146RCI4ZZZBPA,C3224dw,Bluering/Lionfish (BRLF),Verified Purchase,"I understand why this message could be concerning, but I can assure you we do not ship used product.  One possibility is that during the shipping and handling of your unit, some of the toner got to the sensor that detects a full waste toner bottle. If so, this could be fixed by simply removing the waste bottle and tapping it on a hard surface.  If this isn't successful, we can have a replacement bottle shipped to you, simply call 1-800-LEXMARK Monday-Friday, 8:00am to 9:00pm EST (option 1) and we will take care of you. ",4,Great printer...but,0,https://www.amazon.com/gp/customer-reviews/R146RCI4ZZZBPA?ie=UTF8&ASIN=B07T6PGM4J,D. Lord
Yes,Absolute POS. The WiFi feature is a joke. It doesn’t work. Don’t waste your time or money.,Bluering,1,"April 1, 2020",RB17RK0ZRKZE,C3224dw,Bluering/Lionfish (BRLF),Verified Purchase,"Lexmark designs and tests our products for quality and reliability, and we are sorry to hear about the challenges you shared getting started with your new printer.  We hope you will let us help resolve your issues.   We have technical support resources available if you go to  support.lexmark.com and enter your model number ""C3224"".  Once at the product page you will find an option for live ""chat"" support.  You can also call the Lexmark technical support line at 1-800-LEXMARK (1-800-539-6275) Monday-Friday, 8:00am to 9:00pm EST, and select option 1. ",1,WiFi doesn’t work.,0,https://www.amazon.com/gp/customer-reviews/RB17RK0ZRKZE?ie=UTF8&ASIN=B07T6PGM4J,Kindle Customer
Yes,The printer was great in the beginning but now I cannot get it to print at all. It always says it's offline. I've tried everything and it just won't work.,Bluering,1,"March 30, 2020",R1C4N6OGQZK0HV,C3224dw,Bluering/Lionfish (BRLF),Verified Purchase,"Thank you for your feedback. Lexmark products are designed and tested for quality and reliability and hate to hear you are having this issue. For offline connectivity issues, we have resources available at support.lexmark.com, where we offer live support. I also recommend calling our Technical Support at 1-800-LEXMARK (1-800-539-6275) Monday-Friday, 8:00am to 9:00pm EST. Just select the option 1 for technical support.",3,Great printer when it works,1,https://www.amazon.com/gp/customer-reviews/R1C4N6OGQZK0HV?ie=UTF8&ASIN=B07T6PGM4J,dscmpesce
No,I LOVE this laser printer. I bought this printer to solely make water slide decals for my tumbler business. It works great. The print quality is amazing.,Bluering,0,"March 27, 2020",R1YMWP1U6TIY1P,C3224dw,Bluering/Lionfish (BRLF),Verified Purchase,,5,Great Printer!!,0,https://www.amazon.com/gp/customer-reviews/R1YMWP1U6TIY1P?ie=UTF8&ASIN=B07T6PGM4J,Amazon Customer
Yes,"Worked great for like a month, now even though it says it is connected, it is only ever 'unreachable'. I've gone in and set up the connection over and over again. It's like any time I want to print ANYTHING I have to reset to factory settings, reconnect, and print immediately. Wait for more than an hour and it's unreachable with no way to connect unless you go back to factory settings and do everything all over again. Garbage.",Bluering,1,"March 27, 2020",R32N5HZW1PYZHD,C3224dw,Bluering/Lionfish (BRLF),Verified Purchase,"Thanks for your feedback.  We understand that dealing with problems, especially intermittent problems like this, is both inconvenient and frustrating. Lexmark offers a selection of relevant help videos and documents for just this type of setup assistance at support.lexmark.com.  Alternatively, our product support team has been trained to help fix these types of problems and is very skilled at getting you up and running again.  Lexmark support calls are typically answered in under a minute when you call 1-800-LEXMARK (1-800-539-6275) from Monday through Friday, 8:00am to 9:00pm EST. We hope you will give us a chance to resolve this issue.",1,"Love It At First, Now It Is Always 'Device is Unreachable'",0,https://www.amazon.com/gp/customer-reviews/R32N5HZW1PYZHD?ie=UTF8&ASIN=B07T6PGM4J,Snarky Star
No,Its probably the worst printer to have shipped in today's shipping environment. Never worked and I would suggest that no one buy this model. Its extremely hard to setup.Brian,Bluering,0,"March 23, 2020",R32F288TRFH3EM,C3224dw,Bluering/Lionfish (BRLF),Verified Purchase,,1,Horrible Machine,0,https://www.amazon.com/gp/customer-reviews/R32F288TRFH3EM?ie=UTF8&ASIN=B07T6PGM4J,Brian
No,"Easy setup using ethernet connection, wireless connection on my laptop has a problem and the ethernet connection was a good solution for now. I had an older model Lexmark printer X4550 still working and very quite operation, every low noise.except ink cartridge holder broke.",Bluering,0,"March 21, 2020",R2YGW0VRO3KOSB,C3224dw,Bluering/Lionfish (BRLF),Verified Purchase,,5,Great Lexmark printer.,0,https://www.amazon.com/gp/customer-reviews/R2YGW0VRO3KOSB?ie=UTF8&ASIN=B07T6PGM4J,george tahan
No,"So far, I have no complaints for this printer. I bought it because I don't print all that often and was tired of my cartridges drying up in my inkjet printer. I read some of the reviews about the WiFi issues and took the advice of the ones who made their printer's IP address static. No WiFi issues for me. It prints fast with good quality. Very happy with my purchase.",Bluering,0,"March 21, 2020",R21KMQUUGLH80N,C3224dw,Bluering/Lionfish (BRLF),Verified Purchase,,5,Good Printer,0,https://www.amazon.com/gp/customer-reviews/R21KMQUUGLH80N?ie=UTF8&ASIN=B07T6PGM4J,Nickie Donlin
No,"Product received quickly from Amazon. Well packaged. Very easy to set-up and get it on my network. Small footprint and much quieter than my 7 year old HP color laser (and much smaller and lighter). So far, I am very happy with this purchase!",Bluering,0,"March 20, 2020",R2CE2OT3DWUZM6,C3224dw,Bluering/Lionfish (BRLF),Verified Purchase,,5,Perfect Home Office Color Laser Printer!,0,https://www.amazon.com/gp/customer-reviews/R2CE2OT3DWUZM6?ie=UTF8&ASIN=B07T6PGM4J,Chooseup
Yes,"Can't even get to try out a print.. ""REMOVE CARTRIDGE PACKAGING"" Lexmark failed, the doors don't even close properly.",Bluering,1,"March 13, 2020",R3NRYMXAR9G1I9,C3224dw,Bluering/Lionfish (BRLF),Verified Purchase,"Thanks for your feedback, Rodger.  We know dealing with problems like this are both inconvenient and frustrating. We work hard to ensure we delivery high quality products to our customers and your experience clearly falls short of that goal.  We hope you will let us help to resolve this issue. Lexmark support calls are typically answered in under a minute when you call 1-800-LEXMARK (1-800-539-6275) from Monday-Friday 8:00am to 9:00pm EST. ",1,"BAD PRINTER. ERRORS ALL THE TIME, WE GOT TWO, BOTH HAD THE SAME ISSUE",0,https://www.amazon.com/gp/customer-reviews/R3NRYMXAR9G1I9?ie=UTF8&ASIN=B07T6PGM4J,Rodger M.
