id,date,username,badge,stars,model,variation,upvotes,comments,replied,title,url,reply,body
R32T82OS84R45R,"January 10, 2020",Patrick K.,Verified Purchase,4,MB2236adwe,N/A,1,0,No,Adequate,https://www.amazon.com/gp/customer-reviews/R32T82OS84R45R?ie=UTF8&ASIN=B07T3HB1VZ,,"There is little to no documentation for the installation of the printer. Very basic software control from the computer after installation. The touchscreen is rather small, but works okay. I give it 4 stars because the print quality is good, as well as adequate functionality ( double-sided printing, document feeder, scan to email...)."
R3FFZYVQBSZU9Z,"March 14, 2020",Marcell Robinson,Verified Purchase,1,MB2236adw,N/A,0,1,No,Did not Work,https://www.amazon.com/gp/customer-reviews/R3FFZYVQBSZU9Z?ie=UTF8&ASIN=B07N27LPPG,,Unit did not work.
R11KPE3MQXB3T7,"March 11, 2020",Amazon Customer,Verified Purchase,1,MB2236adw,N/A,0,0,No,DO NOT BUY. NON STOP PROBLEMS.,https://www.amazon.com/gp/customer-reviews/R11KPE3MQXB3T7?ie=UTF8&ASIN=B07N27LPPG,,"DO NOT BUY. NON STOP PROBLEMS.Once you fix one problem, another occurs and prevents you from printing/scanning/faxing. We first came across the SMTP server issue. We contact support, and after an hour, still no luck. However, we ending fixing it ourselves. Once we got the printer working and onto our network, it continues to show error state when printing to any computer that tries to print to it. Too much maintenance comes with this printer. Do not recommend it."
R2TJU4SF8JIXJK,"February 22, 2020",Kelly Pfister,Verified Purchase,4,MB2236adw,N/A,2,1,No,Lexmark MB2236,https://www.amazon.com/gp/customer-reviews/R2TJU4SF8JIXJK?ie=UTF8&ASIN=B07N27LPPG,,"I like the printer, however I found out after the fact that there is no local scan to PC option and scanning must be done via the cloud. Had I know this, I would have picked a different all-in-one. That being said, I like how this one prints and the fact that it prints double sided. It is also easy to make copies. Update 2/27/20 I figured out that this will scan to your local PC if you use Windows Fax and Scan. Also, there are some open source software scanners that will also allow you to scan on your local PC. I am using NAPS2 and it works great with this."
RSZI0LMXDJZ2R,"January 18, 2020",KK,Verified Purchase,5,MB2236adw,N/A,0,0,No,Good,https://www.amazon.com/gp/customer-reviews/RSZI0LMXDJZ2R?ie=UTF8&ASIN=B07N27LPPG,,Good
RFVZMEDT33NFW,"December 24, 2019",Piyush Patel,Verified Purchase,5,MB2236adw,N/A,0,0,No,All good,https://www.amazon.com/gp/customer-reviews/RFVZMEDT33NFW?ie=UTF8&ASIN=B07N27LPPG,,Good
R33RH2BI744UBU,"December 10, 2019",CJ,Verified Purchase,1,MB2236adw,N/A,0,0,No,Very difficult to install,https://www.amazon.com/gp/customer-reviews/R33RH2BI744UBU?ie=UTF8&ASIN=B07N27LPPG,,"This product is not very intuitive to use like any other printers I've had before. Literally trying to print was the hardest part to do because there's literally no instructions for it. It gives you step by step picture guide on how to unwrap your printer but actually using it, you are on your own. I tried to look at their website but it's just the same video on how to remove a sticker, etc. I am not ignorant about computers and technology but again, the set-up for this printer is ridiculous. Buyer beware."
R3LW0NN16FHC9M,"November 1, 2019",Theresa J.,Unverified,1,MB2236adw,N/A,5,0,No,Scanner functionlity,https://www.amazon.com/gp/customer-reviews/R3LW0NN16FHC9M?ie=UTF8&ASIN=B07N27LPPG,,"Looks good and reads well on Amazon, however this printer is dysfunctional for everyday use. There is no USB port to print to and for scanning you have to open an application even though the printer key pad option actually have a scan prompt cability. When you use that function, it gives you a hard copy of the document. The technical support team lacks the knowledge about the printer functionalities. In fact when they cannot answer a practical question they lie instead. One tech by the name Yury Alexandra Espinosa Piratoba was very dishonest about calling me back.... still waiting. The case number she gave to me does not exit according to another tech support member. The chat request gives an error after submitting"
RF6NASWD4JHC9,"October 29, 2019",Amazon Customer,Verified Purchase,5,MB2236adw,N/A,0,0,No,Great services,https://www.amazon.com/gp/customer-reviews/RF6NASWD4JHC9?ie=UTF8&ASIN=B07N27LPPG,,So far this has worked great.
R1Y6A2U1KQB99L,"October 17, 2019",DConn,Verified Purchase,3,MB2236adw,N/A,1,0,No,Onerous Setup,https://www.amazon.com/gp/customer-reviews/R1Y6A2U1KQB99L?ie=UTF8&ASIN=B07N27LPPG,,"If you are looking to just plug and play, you are out of gas. Why oh why didn't I believe the other reviewers??? Anyway, after 2 hours over 2 different days, with 2 different techs, I can FINALLY send docs from the scanner to my PC! I haven't actually used it for it's intended purpose (I'm a NSA who needs to scan back large numbers of pages to my PC and upload to secure servers). I have a job this evening...I hope it goes well.With that said, if you want to just print your scans, it may be easy peasy."
R2VNVG66D8I9Z,"August 15, 2019",Sadie Parker,Vine Customer,5,MB2236adw,N/A,0,1,No,LOVE,https://www.amazon.com/gp/customer-reviews/R2VNVG66D8I9Z?ie=UTF8&ASIN=B07N27LPPG,,"this printer is awesome!The printer itself is heavy and sturdy and comes packaged in a strong box. Once I unpacked it, I was able to Get it going by connecting it to my wifi at home. It is fast, has great color and it quiet. I havenâ€™t tried to fax anything and I wonâ€™t use that feature. But the scanning works great and does the printing. I am very happy!"
R1GBLY98MM6YHP,"March 8, 2020",ragusowe,Verified Purchase,5,B2236dw,N/A,0,0,No,Good printer,https://www.amazon.com/gp/customer-reviews/R1GBLY98MM6YHP?ie=UTF8&ASIN=B07N23D92N,,"Fast printer , excellent quality , use in home"
R201NCFF76FQ13,"February 22, 2020",Marianne R,Unverified,3,B2236dw,N/A,1,0,No,USB setup ok - awful setup for wireless,https://www.amazon.com/gp/customer-reviews/R201NCFF76FQ13?ie=UTF8&ASIN=B07N23D92N,,"I am an IT professional and have connected hundreds of types of printers to Windows.I have spent over 8 hours trying to set this up wirelessly. It has an IP - it can be pinged on my home network, but no jobs will print and it keeps going into a blue flashing mode of waiting and I have to reboot to clear it. The tiny config screen is dim and very hard to read. I have tried multiple drivers. It is just the WORST printer I have ever tried to connect wirelessly to WIndows. If you are going to use it by USB - go for it. Otherwise - you are only buying fustration.Update - I set it within a few feet of an a wireless access point and it was able to connect and stay connected. Wireless printers are known to have trouble establishing and keeping a wireless connection unless the card and the signal are strong - so this printer is acting like many wireless printers. Set it up as USB or Ethernet or close to access point and then share wirelessly."
R27KLWBZHVHCZ0,"February 4, 2020",cntrygal,Verified Purchase,5,B2236dw,N/A,0,0,No,"Donâ€™t hesitate to buy, itâ€™s perfect!!",https://www.amazon.com/gp/customer-reviews/R27KLWBZHVHCZ0?ie=UTF8&ASIN=B07N23D92N,,I love this printer!!
R3IUZZYH6J2X8V,"February 1, 2020",Darien J. Pratchett,Verified Purchase,5,B2236dw,N/A,0,0,No,Works great.,https://www.amazon.com/gp/customer-reviews/R3IUZZYH6J2X8V?ie=UTF8&ASIN=B07N23D92N,,Works great. Use it on a network. Recommend using browser setup.
R3S2X8LKU9A9CB,"January 29, 2020",jack christensen,Verified Purchase,1,B2236dw,N/A,0,0,No,Do Not Buy if Mobile app,https://www.amazon.com/gp/customer-reviews/R3S2X8LKU9A9CB?ie=UTF8&ASIN=B07N23D92N,,If you where expecting an easy to use plug and play for a mobile printer Do Not Buy. 4 hours of trying to setup app and 1 hour on so called customer support and it didn't work. Sent back the same day.
RLZ4YYOM4V61H,"January 21, 2020",Margo Kent,Verified Purchase,4,B2236dw,N/A,0,0,No,Great printer for the price,https://www.amazon.com/gp/customer-reviews/RLZ4YYOM4V61H?ie=UTF8&ASIN=B07N23D92N,,Easy to set up. Large capacity paper tray. Good print quality
R12BUGPUI21V99,"December 6, 2019",Splarch,Verified Purchase,4,B2236dw,N/A,0,0,No,Decent Printer,https://www.amazon.com/gp/customer-reviews/R12BUGPUI21V99?ie=UTF8&ASIN=B07N23D92N,,"It does the job. It's very basic, and setup is a little annoying. Having to go through the setup options on the tiny little 1-line screen even though you can get into the web interface and set everything up is a little annoying. That said, being able to put these anywhere via WiFi has enabled me to easily put these small printers into out-of-the-way spots in offices that may not have Ethernet cables. Not for heavy lifting, limited duty printers, great to put a laser printer into a location where you need it without too much trouble. Windows print server deployed, no issues there."
R2SX8W7M3MJTFW,"November 22, 2019",RBeckham,Verified Purchase,1,B2236dw,N/A,1,0,No,Terrible At Envelopes,https://www.amazon.com/gp/customer-reviews/R2SX8W7M3MJTFW?ie=UTF8&ASIN=B07N23D92N,,"I have a heavy duty color laser for other things, so I needed a small monochrome printer like this to use for envelopes only. My previous Lexmark printer was very good for this. Unfortunately this one is terrible, at least for #10 (standard letter size) envelopes. It consistently creases one corner to make them look quite unprofessional (as in ""like crap""). I haven't yet decided whether to go to all the hassle of returning it, or just junking it. (And yes, of course I'm using the envelope feeder above the paper tray)."
R7TUU171KUZZ9,"November 7, 2019",rose,Verified Purchase,5,B2236dw,N/A,0,0,No,GREAT PRICED PRINTER,https://www.amazon.com/gp/customer-reviews/R7TUU171KUZZ9?ie=UTF8&ASIN=B07N23D92N,,Lexmark has great quality printers
R1JWBU0U5VWNV3,"October 19, 2019",point guard 65,Verified Purchase,5,B2236dw,N/A,0,0,No,Good printer for the money.,https://www.amazon.com/gp/customer-reviews/R1JWBU0U5VWNV3?ie=UTF8&ASIN=B07N23D92N,,Easy and reliable to use -- puts out nice copies.
R2CI18JQ4ATMWK,"December 21, 2019",M-I-Wright,Verified Purchase,5,C3326dw,N/A,0,0,No,Best printer for the price that packs a punch!,https://www.amazon.com/gp/customer-reviews/R2CI18JQ4ATMWK?ie=UTF8&ASIN=B07T3H979V,,Best printer for the price that packs a punch!
R27H700NWESK41,"December 16, 2019",Darlene,Verified Purchase,3,C3326dw,N/A,5,0,No,Print quality questionable,https://www.amazon.com/gp/customer-reviews/R27H700NWESK41?ie=UTF8&ASIN=B07T3H979V,,Not sure about this printer yet. Usually an inkjet user but needed a cost friendly laser printer and after research this is the one I choose. Not sure if Iâ€™m just used to the color saturation I get with my inkjet or if having trouble correcting print quality. I will search some solutions on the web and update. I really want to like this printer but as of this review I can only give 2 stars.
RWPV9HSNSIQG8,"December 9, 2019",Christopher L. Paul,Verified Purchase,5,C3326dw,N/A,0,0,No,As expected,https://www.amazon.com/gp/customer-reviews/RWPV9HSNSIQG8?ie=UTF8&ASIN=B07T3H979V,,"Excellent wireless printer. Exactly as advertised, exactly what I wanted."
R3TYOLDZE0HDT,"December 6, 2019",Lee,Verified Purchase,1,C3326dw,N/A,5,0,No,Jams constantly!,https://www.amazon.com/gp/customer-reviews/R3TYOLDZE0HDT?ie=UTF8&ASIN=B07T3H979V,,This is the worst printer I have ever purchased. Multiple paper jams throughout every day. You have to keep the paper tray completely full at all times. Envelope printing is erratic with paper jams. Never again!
RYR0ZINX0GTL0,"December 4, 2019",Wendi Barker,Vine Customer,4,C3326dw,N/A,0,0,No,"Crisp Clear Prints, Easy to Set Up, 250 Page Paper Tray",https://www.amazon.com/gp/customer-reviews/RYR0ZINX0GTL0?ie=UTF8&ASIN=B07T3H979V,,"This is my first personal laser printer - I've always had inkjets because of the cost of toner vs the cost of ink. That said, the past two inkjet printers we've had in our house have started out great and ended horribly, with connectivity issues and smeared pages.So far this is love-at-first-print. Out of the box, this was easy to set up and pretty quick. I did install an app on my phone which made getting it going pretty easy.So far, I'm able to print and the prints are great - both black and white and color turn out great. It is a tad louder than our inkjet, but the print quality is so clear! And no smearing.Another plus is the paper capacity. Our old printer had to be reloaded often, with a paper tray that holds 250My biggest concern is the cost of replacement toner, but honestly, it might be cheaper in the long run. To keep my last printer going (kind of - with murky prints) I had to replace a maintenance box twice, so the costs were adding up.At the time of writing this, it looks like there is a black toner cartridge return program that costs $85 for the black toner, making the black replacement a little less than 1/2 the cost of the printer itself - so it might just be cheaper to purchase an all-new printer when this one runs out of toner, or at least two colors."
R3PX6BZ14XLM2W,"November 19, 2019",Many Words,Verified Purchase,5,C3326dw,N/A,5,0,No,A little bit longer than advertised - but excellent machine,https://www.amazon.com/gp/customer-reviews/R3PX6BZ14XLM2W?ie=UTF8&ASIN=B07T3H979V,,"Just got the printer on line - which was simple enough although the documentation is Windows oriented - Mac set up was just follow the menu items on the printer screen and when complete - it just worked. Love the color, clarity, and ease of changing the cartridges. This is the best design... just pull open a drawer from the front, and they are laying in there in order. Lift and replace. No digging into the internals of the printer. No lifting the top of the printer. Just pull and all cartridges are available for you to replace. One of my other selection criteria was the length of the unit. My printer lives in a cabinet that is 16 inches deep and this was advertised at 15.5 inches. What isn't noted is the cord plugs into the back and goes straight back from the printer's plug. This means the effective depth is 17 inches due to the room needed to bend the cord. I have purchased a right angle plug to deal with this and that will solve my relatively small problem. The printer has a noise level when printing (and did quiet when not) however, its not much different from the Brother laser printer it replaced and is less noisy than an ink jet. For its price point and functionality - it is no problem."
RSP4J3G9KUG9G,"November 4, 2019",E. Weber,Vine Customer,3,C3326dw,N/A,1,0,No,Loud and blotchy,https://www.amazon.com/gp/customer-reviews/RSP4J3G9KUG9G?ie=UTF8&ASIN=B07T3H979V,,This is a fairly affordable laser color printer (the replacement cartridges look expensive).The installation was relatively easy and I didn't hit any particular issues. I started with wired network but settled with WiFi network connectivity which was also easy to setup.The printing speed is really good but the printer is very noisy.I also found that the print quality is not as crips are my black and white laser printer for simple documents. The letters look a little blotchier that I would want. I probably will only use this printer to print pictures.
R28BZQY1LG9EMK,"October 6, 2019",Julia Duke,Verified Purchase,4,C3326dw,N/A,7,0,No,A great purchase worth the money.,https://www.amazon.com/gp/customer-reviews/R28BZQY1LG9EMK?ie=UTF8&ASIN=B07T3H979V,,This printer is awesome. I was concerned about switching from an inkjet to a laser and I'm so happy I did. The print quality is amazing. Everything is so crisp and clear compared to my inkjet. The only thing I wish I could do is print pictures. I mean I can print them on 8x10 but cannot print anything smaller. This printer is also really heavy which is good and bad. Makes it very difficult to move but also means its heavy duty well made. I would definitely recommend this if you are looking for a good laser.
R78LTQL1GKLRY,"September 18, 2019",Dr. Spetter,Verified Purchase,2,C3326dw,N/A,8,0,No,Decent Printer but Noisey and Expensive,https://www.amazon.com/gp/customer-reviews/R78LTQL1GKLRY?ie=UTF8&ASIN=B07T3H979V,,"Printing is extremely loud and after a few months of ownership, I have had to replace the toner twice with typical office use. This thing is costing me a fortune in toner. In addition, I get constant offline errors and any PDF document will take from 5 to 15 mins just to process before it even starts printing. Avoid this one if your planning any kind of office deployment"
R2077BT3RVMNAQ,"September 6, 2019",Zack Damen,Verified Purchase,5,C3326dw,N/A,1,0,No,Good Color Laser,https://www.amazon.com/gp/customer-reviews/R2077BT3RVMNAQ?ie=UTF8&ASIN=B07T3H979V,,If you want a fast color laser printer and built like a rock then you found the prefect one!
R30HHEORE51BNN,"February 1, 2020",Joan & Marlin McGowin,Verified Purchase,4,MC3224adwe,N/A,0,0,No,Time will tell,https://www.amazon.com/gp/customer-reviews/R30HHEORE51BNN?ie=UTF8&ASIN=B07T4LGDGQ,,So far so good for us.
R3FHV47UX4SZBR,"January 30, 2020",Bargn Hntr,Vine Customer,4,MC3224adwe,N/A,0,0,No,So much better than the Canon ImageCLASS,https://www.amazon.com/gp/customer-reviews/R3FHV47UX4SZBR?ie=UTF8&ASIN=B07T4LGDGQ,,OMG I donâ€™t know why I ever bought Canons. The set up was easy and it stays connected without giving me errors every week and having to be reset like my Canons. The print speed is as good or better than my Canon ImageCLASS MF642Cdw. For me I would not switch back to the Canons this is affordable and is much more dependable
R1UAOBFVNS67V5,"January 29, 2020",Cindy Jones,Verified Purchase,2,MC3224adwe,N/A,0,0,No,Disatisfied!,https://www.amazon.com/gp/customer-reviews/R1UAOBFVNS67V5?ie=UTF8&ASIN=B07T4LGDGQ,,"I have NEVER had a printer that goes offline so OFTEN. And, now it's printing everything double, especially if it's color. I'm trying to figure out how to return it for a refund. I don't have the original box."
R369HGTT00BZAG,"January 22, 2020",WRX X,Verified Purchase,1,MC3224adwe,N/A,0,0,No,"Defective out of the box, support is almost non existent",https://www.amazon.com/gp/customer-reviews/R369HGTT00BZAG?ie=UTF8&ASIN=B07T4LGDGQ,,"i ordered this printer for home use. It was very inexpensive and with laser you don't really have to worry about cartridges drying out. After unpacking and removing the shipping protectors the printer kept complaining about shipping materials inside the cartridges. I kept looking for stuff to remove to no avail. I called support and i was told that this is a common problem with this printer, and they will rma it and send me a new one, and i will send this back. Well a week after the call the support rep keeps telling me that the tracking numbers will be available in 2 days. This has been going on for about a week now and no tracking numbers. I am ready to return this unit to amazon and be done with this brand. The only reason i got this is because it was very inexpensive, and with our usage the printer will be obsolete before the starter cartridges will be out."
R3UWJ09HIMIRUC,"January 20, 2020",DM,Verified Purchase,1,MC3224adwe,N/A,0,2,No,So Many Problems,https://www.amazon.com/gp/customer-reviews/R3UWJ09HIMIRUC?ie=UTF8&ASIN=B07T4LGDGQ,,"Everything that could possibly go wrong with this device does. Printer constantly drops offline, scanner works like 20% of the time. Constantly having to restart the device just to get it to work. And if you can even get it to print, the pages sometimes come out all black??? What a waste of toner. Touch screen is nice, though."
R3KMHZL85GGGGT,"January 18, 2020",heatherg,Verified Purchase,1,MC3224adwe,N/A,0,1,No,Doesn't work for cardstock,https://www.amazon.com/gp/customer-reviews/R3KMHZL85GGGGT?ie=UTF8&ASIN=B07T4LGDGQ,,"Having trouble printing on cardstock, which is what I bought it for. Ink is hard to get and incredibly expensive. I bought a black ink from BlueDogInk (Lexmark brand) and it says it's half-full but it's printing shadows on my pages and I have to take it out and shake it to get the streaks it's making to stop. Wish I'd never bought this."
RSOO35603X5GM,"January 18, 2020",Kevin G,Verified Purchase,1,MC3224adwe,N/A,1,0,No,"Poor wi-fi, expensive and difficult to find toner cartridges.",https://www.amazon.com/gp/customer-reviews/RSOO35603X5GM?ie=UTF8&ASIN=B07T4LGDGQ,,Does not maintain wi-fi connection after power-down. Cannot find print cartridges locally. Does not maintain communication with computer through router. Very disappointed.
RH9FS1D2JXWF9,"January 7, 2020",Bradford D.,Verified Purchase,2,MC3224adwe,N/A,1,1,No,Keeps rebooting,https://www.amazon.com/gp/customer-reviews/RH9FS1D2JXWF9?ie=UTF8&ASIN=B07T4LGDGQ,,The BIOS is unstable for some reason. Keeps rebooting.
R12PJBTAR767SP,"January 4, 2020",Cynthia Martinez,Verified Purchase,4,MC3224adwe,N/A,2,0,No,Ink cartridge,https://www.amazon.com/gp/customer-reviews/R12PJBTAR767SP?ie=UTF8&ASIN=B07T4LGDGQ,,the printer is great the only down fall is the price on having to change out the ink cartridge. you're better off buying a new printer all over again because the ink cartridges are the same if not more costly than the printer itself.
R32V7NI6AHJEES,"December 12, 2019",D. Lebow,Verified Purchase,5,MC3224adwe,N/A,2,0,No,"Impressive printer, works great with macOS!",https://www.amazon.com/gp/customer-reviews/R32V7NI6AHJEES?ie=UTF8&ASIN=B07T4LGDGQ,,"This is a really good little color laser multifunction printer. Iâ€™m on macOS and I was wary of a few negative reviews about the lack of Apple software for this unit, but I have a friend who is a Lexmark dealer and authorized repair center, so I thought it was worth the risk.Itâ€™s true that there is no Mac driver for this unit, but you donâ€™t need it. Unpacking and setting up was easyâ€¦ And using the free Lexmark iOS app to set up my Wi-Fi connection couldnâ€™t have been simpler. My Mac Pro saw the printer instantly and I was up and running in two minutes.And while there is no Lexmark software to run this printerâ€¦ I already owned VueScan, A third-party scanning softwareâ€¦ And it runs this printer perfectly, including all of the options for resolution, flatbed scanning, document feeder scanning, and everything else. You can also access all of the printers options through your web browser by locating the printers address on your home network.Soâ€¦ Absolutely a joy to set up and use with my Mac Pro running Mojave."
R2UTTFHICRQPDI,"October 11, 2019",Grant Fritchey,Vine Customer,5,MC3326adwe,N/A,1,0,No,Marvelous,https://www.amazon.com/gp/customer-reviews/R2UTTFHICRQPDI?ie=UTF8&ASIN=B07T5PRRXD,,"Remember the old days in computing when getting a new printer was an exercise in terror? Those days are long gone and I don't miss them. I plugged this in. Connected it to my wife's tablet. It worked. Heck, before we did that, I had to run a copy of something real quick. I had already plugged it in, so I just hit the copy button after feeding what we needed into the right slot. That worked.So, yeah, there's more to it than that. We set up the printer on the WIFI at home. I used the interface directly on the printer. It was easy, quick and intuitive. I had no more finished when my machine beeped. It had recognized the printer and had already negotiated my machine to have access to it.The only work involved was getting the scanning software set up on my wife's machine and then getting her to act as the scan recipient (my machine had assumed that job). It was maybe, five minutes, max.The quality of the prints are good. The noise factor is low. The speed is adequate for a small family and a work-out-of-the-house business. Scans are accurate. Copies are accurate. The entire thing is just working, right out of the box with minimal setup or labor. So much better than the old days."
R1V4T7XPTAVZ60,"October 5, 2019",Sherry Berry,Vine Customer,3,MC3326adwe,N/A,1,0,No,Lots of bells and whistles - but replacement ink is ridiculous,https://www.amazon.com/gp/customer-reviews/R1V4T7XPTAVZ60?ie=UTF8&ASIN=B07T5PRRXD,,"Take a look before you buy. The price on the replacement ink is enough to buy another printer AND more. There are four different toners that would need replacement. In terms of the setup, it's not too difficult to setup just standard printing and copying. However, the scanning feature is a joke. You can scan to e-mail or scan to a USB. I did not find anywhere that would allow you to scan to your PC, the most basic functionality that would make scanning make sense. The document feeder works fine and wireless was easy to set up.This unit is quite heavy. The printing is decently fast but I've only used it for printing black and white so far. I've seen better, honestly, and with the price point, I expected slightly more."
R3HMTK8MWQJL9C,"October 5, 2019",James Evans,Verified Purchase,4,MC3326adwe,N/A,1,0,No,So far so good,https://www.amazon.com/gp/customer-reviews/R3HMTK8MWQJL9C?ie=UTF8&ASIN=B07T5PRRXD,,Excellent full featured printer. My first Lexmark after using Brother and HP printers. Easy to set up and use with very good printing results. Only mark down is for the extremely expensive separate black and three (3) separate color cartridges. I will respond later about experience with more time in usage and cartridge life.
RPRGMWSBJI435,"October 4, 2019",IAmanonymous,Vine Customer,4,MC3326adwe,N/A,0,0,No,Very good quality,https://www.amazon.com/gp/customer-reviews/RPRGMWSBJI435?ie=UTF8&ASIN=B07T5PRRXD,,"This printer prints very high quality, and at a pretty good speed. Ink seems to be long lasting. This printer is full sized, and definitely not compact, but the printed results are outstanding."
