id,date,username,badge,stars,model,variation,upvotes,comments,replied,title,url,reply,body
R1YMWP1U6TIY1P,"March 27, 2020",Amazon Customer,Verified Purchase,5,C3224dw,N/A,0,0,No,Great Printer!!,https://www.amazon.com/gp/customer-reviews/R1YMWP1U6TIY1P?ie=UTF8&ASIN=B07T6PGM4J,,I LOVE this laser printer. I bought this printer to solely make water slide decals for my tumbler business. It works great. The print quality is amazing.
R32N5HZW1PYZHD,"March 27, 2020",Snarky Star,Verified Purchase,1,C3224dw,N/A,0,0,No,"Love It At First, Now It Is Always 'Device is Unreachable'",https://www.amazon.com/gp/customer-reviews/R32N5HZW1PYZHD?ie=UTF8&ASIN=B07T6PGM4J,,"Worked great for like a month, now even though it says it is connected, it is only ever 'unreachable'. I've gone in and set up the connection over and over again. It's like any time I want to print ANYTHING I have to reset to factory settings, reconnect, and print immediately. Wait for more than an hour and it's unreachable with no way to connect unless you go back to factory settings and do everything all over again. Garbage."
R32F288TRFH3EM,"March 23, 2020",Brian,Verified Purchase,1,C3224dw,N/A,0,0,No,Horrible Machine,https://www.amazon.com/gp/customer-reviews/R32F288TRFH3EM?ie=UTF8&ASIN=B07T6PGM4J,,Its probably the worst printer to have shipped in today's shipping environment. Never worked and I would suggest that no one buy this model. Its extremely hard to setup.Brian
R2YGW0VRO3KOSB,"March 21, 2020",george tahan,Verified Purchase,5,C3224dw,N/A,0,0,No,Great Lexmark printer.,https://www.amazon.com/gp/customer-reviews/R2YGW0VRO3KOSB?ie=UTF8&ASIN=B07T6PGM4J,,"Easy setup using ethernet connection, wireless connection on my laptop has a problem and the ethernet connection was a good solution for now. I had an older model Lexmark printer X4550 still working and very quite operation, every low noise.except ink cartridge holder broke."
R21KMQUUGLH80N,"March 21, 2020",Nickie Donlin,Verified Purchase,5,C3224dw,N/A,0,0,No,Good Printer,https://www.amazon.com/gp/customer-reviews/R21KMQUUGLH80N?ie=UTF8&ASIN=B07T6PGM4J,,"So far, I have no complaints for this printer. I bought it because I don't print all that often and was tired of my cartridges drying up in my inkjet printer. I read some of the reviews about the WiFi issues and took the advice of the ones who made their printer's IP address static. No WiFi issues for me. It prints fast with good quality. Very happy with my purchase."
R2CE2OT3DWUZM6,"March 20, 2020",Chooseup,Verified Purchase,5,C3224dw,N/A,0,0,No,Perfect Home Office Color Laser Printer!,https://www.amazon.com/gp/customer-reviews/R2CE2OT3DWUZM6?ie=UTF8&ASIN=B07T6PGM4J,,"Product received quickly from Amazon. Well packaged. Very easy to set-up and get it on my network. Small footprint and much quieter than my 7 year old HP color laser (and much smaller and lighter). So far, I am very happy with this purchase!"
R3NRYMXAR9G1I9,"March 13, 2020",Rodger M.,Verified Purchase,1,C3224dw,N/A,0,1,No,"BAD PRINTER. ERRORS ALL THE TIME, WE GOT TWO, BOTH HAD THE SAME ISSUE",https://www.amazon.com/gp/customer-reviews/R3NRYMXAR9G1I9?ie=UTF8&ASIN=B07T6PGM4J,,"Can't even get to try out a print.. ""REMOVE CARTRIDGE PACKAGING"" Lexmark failed, the doors don't even close properly."
R12R4GJFF35RYO,"March 13, 2020",Raleigh Araga,Verified Purchase,2,C3224dw,N/A,0,0,No,"Great quality, bad connection problems.",https://www.amazon.com/gp/customer-reviews/R12R4GJFF35RYO?ie=UTF8&ASIN=B07T6PGM4J,,"The printer itself is pretty good. It prints great colored prints, not necessarily top grade for photographers, but sufficient enough for everyday-use colored fliers and portraits. After reading the other reviews, I thought I wouldn't have any issues with connections and that the other buyers complaining of connection issues were isolated incidents; I was wrong. What good is a printer that prints excellent pictures but constantly disconnects from your devices when you need it?! It was constantly offline. I decided to return and go with a more reliable Canon."
R23V3FK5MSBLUV,"March 11, 2020",Luis Proano,Verified Purchase,5,C3224dw,N/A,0,0,No,nbice,https://www.amazon.com/gp/customer-reviews/R23V3FK5MSBLUV?ie=UTF8&ASIN=B07T6PGM4J,,i like
R1K5L8J0WP5ET5,"March 10, 2020",schultz,Verified Purchase,5,C3224dw,N/A,0,0,No,It prints,https://www.amazon.com/gp/customer-reviews/R1K5L8J0WP5ET5?ie=UTF8&ASIN=B07T6PGM4J,,Seems to be working as advertised
R2O8X35XHSOT92,"March 27, 2020",William F. Stasior,Verified Purchase,1,C3326dw,N/A,0,0,No,Printer broke after a short period of light use.  Support hasn't been helpful.,https://www.amazon.com/gp/customer-reviews/R2O8X35XHSOT92?ie=UTF8&ASIN=B07T3H979V,,"This seemed like a pretty good printer. It was fast and reliable and while it was very loud when printing, it was silent at all other times. After 5 months of light usage it started printing repeated fat lines of black, magenta, blue, and yellow on every page. It looks more like printing than toner smearing. I tried to contact customer support but there are a lot of roadblocks to getting to an actual person and I don't have time to step through all the hoops so I'm writing it off and buying another brand."
RI2GVEY8CPMXP,"March 27, 2020",Josh,Verified Purchase,5,C3326dw,N/A,0,0,No,Just WOW!!! I love it!,https://www.amazon.com/gp/customer-reviews/RI2GVEY8CPMXP?ie=UTF8&ASIN=B07T3H979V,,"Stop wasting your time with inkjet printers, laser is the way to go!So far I am loving this printer. Setup was a breeze and I was printing in about 5 mins."
R1FZROXOFH46HK,"February 12, 2020",Pen Name,Verified Purchase,5,C3326dw,N/A,0,0,No,Great item,https://www.amazon.com/gp/customer-reviews/R1FZROXOFH46HK?ie=UTF8&ASIN=B07T3H979V,,"Great item, duplex works great and color quality is great"
R1Q7BO5SP9FHK8,"February 1, 2020",Brad Cosner,Verified Purchase,5,C3326dw,N/A,0,0,No,Good quality,https://www.amazon.com/gp/customer-reviews/R1Q7BO5SP9FHK8?ie=UTF8&ASIN=B07T3H979V,,Got this for Christmas and I love it. Have to be careful using other papers though. I've gotten two paper jams already.
R2ABEEGKUTWBQ3,"February 1, 2020",Kindle Customer,Verified Purchase,5,C3326dw,N/A,1,1,No,Great Compact Color Printer,https://www.amazon.com/gp/customer-reviews/R2ABEEGKUTWBQ3?ie=UTF8&ASIN=B07T3H979V,,"I purchased the Lexmark color laser printer for my classroom. The compact shape and size of the printer is perfect for small spaces. It yields double-sided, crisp, color documents rapidly with no paper jams."
R33H6LH1WPTH38,"January 29, 2020",sri,Verified Purchase,5,C3326dw,N/A,0,0,No,Great value printer,https://www.amazon.com/gp/customer-reviews/R33H6LH1WPTH38?ie=UTF8&ASIN=B07T3H979V,,"Great printer, a bit noisy, but gets the job done quickly"
R2FECNVJWLDZ8N,"January 22, 2020",Kindle Customer,Verified Purchase,2,C3326dw,N/A,1,1,No,Disappointing,https://www.amazon.com/gp/customer-reviews/R2FECNVJWLDZ8N?ie=UTF8&ASIN=B07T3H979V,,It does not print pictures well
R3DNVBSCG3IKVO,"January 13, 2020",ionei,Verified Purchase,4,C3326dw,N/A,0,0,No,"Big, but does the job",https://www.amazon.com/gp/customer-reviews/R3DNVBSCG3IKVO?ie=UTF8&ASIN=B07T3H979V,,"print quality is great, but then again Ive only had it for a month; all my printers did a great job for several months. I'll re-review if a problem comes up.The thing is big and heavy enough I was worried as I set it down on my glass shelf, but it was ok. Set up was relatively easy, connecting the 5 laptops in the family to it took little time (though for some reason one computer came out with weird settings that had to be reset to normal). Prints pretty quickly but with a fair amount of noise compared to my old (inkjet) printer."
RJK6ON53WI7VO,"January 8, 2020",F. Pearl,Verified Purchase,5,C3326dw,N/A,0,0,No,Great printer for professional looking results,https://www.amazon.com/gp/customer-reviews/RJK6ON53WI7VO?ie=UTF8&ASIN=B07T3H979V,,"Excellent printer for value and quality. The starter toner does not last long so consider toner cost when buying the printer. I used it for printing brochures, which looked awesome compared to the inkjet ones."
R2N1H6N470LYGV,"December 24, 2019",miriam garcia,Verified Purchase,5,C3326dw,N/A,0,0,No,works excellent,https://www.amazon.com/gp/customer-reviews/R2N1H6N470LYGV?ie=UTF8&ASIN=B07T3H979V,,Works excellent.
RCZQ7BFHLX5FJ,"March 22, 2020",Jose Manuel Jaquez,Verified Purchase,4,MC3224adwe,N/A,0,0,No,Physical design is perfectly built. Software issues.,https://www.amazon.com/gp/customer-reviews/RCZQ7BFHLX5FJ?ie=UTF8&ASIN=B07T4LGDGQ,,"I am a technician, And I have bough two of this printer. So far what I had found it looks like there is some conflict with the firmware in this printer (drivers issues).But it will work as the manufacturer expected when they fix a posible bug in the software part."
R1CH777KCGNE16,"March 19, 2020",Junior E.,Verified Purchase,5,MC3224adwe,N/A,0,0,No,Good,https://www.amazon.com/gp/customer-reviews/R1CH777KCGNE16?ie=UTF8&ASIN=B07T4LGDGQ,,Ok
R2Q7QKKZXD74IE,"March 16, 2020",J. Browning,Verified Purchase,1,MC3224adwe,N/A,0,0,No,Finding ink is an expensive and frustrating ordeal,https://www.amazon.com/gp/customer-reviews/R2Q7QKKZXD74IE?ie=UTF8&ASIN=B07T4LGDGQ,,I order the cartridge numbers that were on the cartridges that came in the printer and they didn't work. Turns out there is a secondary cartridge number you have to order and I cannot find them anywhere. I now have $300 in ink I can't use and can't return but can't find the ones I need! By looking at the cost of the ink vs. other printers it would probably be cheaper to buy a new printer to match the cartridges I've got anyway!
R1AKLHNBKAIHGN,"March 14, 2020",SEYMOUR SCAGNETTI,Verified Purchase,5,MC3224adwe,N/A,0,0,No,SOLID LEXMARK PRODUCT,https://www.amazon.com/gp/customer-reviews/R1AKLHNBKAIHGN?ie=UTF8&ASIN=B07T4LGDGQ,,"OUTSTANDING VALUE FROM AMAZON WAREHOUSE. MY 10 YEAR OLD HP ENVY 110 INKJET FINALLY DIED. THIS IS MY 1st. LASER (ALSO COLOR). EXTREMELY IMPRESSED WITH THE BUILD AND PRINT QUALITY. WIRELESS WORKS FLAWLESS. AM LOOKING FORWARD TO NO MORE DRIED INK CARTRIDGES AND WASTED MONEY. THANKS AGAIN AMAZON WAREHOUSE. WAS LISTED AS USED ACCEPTABLE. OUTER BOX HAD WEAR AND TEAR FROM HANDLING AND STORAGE, BUT THE ITEM WAS BRAND NEW, FACTORY SEALED WITH ALL PLASTICS AND SHIPPING TAPES INTACT."
R3TG7QM7OJP02H,"March 12, 2020",M. Lane,Verified Purchase,4,MC3224adwe,N/A,0,0,No,Printer ok but not ok,https://www.amazon.com/gp/customer-reviews/R3TG7QM7OJP02H?ie=UTF8&ASIN=B07T4LGDGQ,,I did not get an ownerâ€™s manual and have trouble with connection issues
R1M1OO5BN0G06H,"March 10, 2020",MJ,Verified Purchase,4,MC3224adwe,N/A,0,0,No,Laser Printer,https://www.amazon.com/gp/customer-reviews/R1M1OO5BN0G06H?ie=UTF8&ASIN=B07T4LGDGQ,,I wanted to upgrade to a laser printer and was told by my son to get a Lexmark that is what his clients have had good luck with. I have been using it now for a few weeks and it is printing beautifully. So far I am seeing a big improvement in my ink usage. My only issue is that it sometimes go into such a deep sleep that I have to unplug it and replug it back in to reset it. I will search when I get a chance to see if their is a remedy for this once I am able to do so.
RQASILPRCWWL2,"March 3, 2020",Amazon Customer,Verified Purchase,1,MC3224adwe,N/A,0,1,No,Not connecting wire,https://www.amazon.com/gp/customer-reviews/RQASILPRCWWL2?ie=UTF8&ASIN=B07T4LGDGQ,,"Why is it not connecting with wireless connections, like a router, I have other printers from other companies but only this one is not connecting?"
RJK1DEBRDB1ZB,"February 23, 2020",Edwin Combs,Unverified,5,MC3224adwe,N/A,0,0,No,I own this printer and so far it works great,https://www.amazon.com/gp/customer-reviews/RJK1DEBRDB1ZB?ie=UTF8&ASIN=B07T4LGDGQ,,"I own this printer and the print quality is very good. I use it as a home printer/scanner/copier. I was going to buy an eco-tank Epson, but I go long periods without printing and inkjets get clogged nozzles. So far with this printer, I have no complaints. Toner is expensive, but in time there will be a cheaper third party alternative."
R4EPR22CU0QWU,"February 19, 2020",William A. Garlin Jr.,Verified Purchase,5,MC3224adwe,N/A,0,0,No,Nice Update,https://www.amazon.com/gp/customer-reviews/R4EPR22CU0QWU?ie=UTF8&ASIN=B07T4LGDGQ,,More compact than the unit it replaced and it does more.
R3E5PJ124P1FU,"February 14, 2020",Marcelo Tettamanti,Verified Purchase,2,MC3224adwe,N/A,1,1,No,Tough to make it work with obsolete PC software,https://www.amazon.com/gp/customer-reviews/R3E5PJ124P1FU?ie=UTF8&ASIN=B07T4LGDGQ,,"Print quality is ok. Trying to scan was a nightmare. I've managed over 5 different multifunction printers and the software of this system is a nightmare. You don't even have a straight forward, single push, SCAN button in your main options. I keep getting lured by price and end up repenting on these second grade brands."
R1YARC8VJQ6K6I,"February 27, 2020",MargoðŸ˜‡,Verified Purchase,5,MC3326adwe,N/A,0,0,No,Great LASER PRINTER! ðŸ˜ƒ,https://www.amazon.com/gp/customer-reviews/R1YARC8VJQ6K6I?ie=UTF8&ASIN=B07T5PRRXD,,Love it! ðŸ˜ƒHome office & personal use.
R1TIU7XDSNYSCQ,"February 4, 2020",Charles Harrison,Verified Purchase,5,MC3326adwe,N/A,0,0,No,Works great,https://www.amazon.com/gp/customer-reviews/R1TIU7XDSNYSCQ?ie=UTF8&ASIN=B07T5PRRXD,,"I really like this printer. I liked my last Lexmark, but my wife wanted color, so I bought this one. Works great with good quality print and duplexing."
R1ZJ5A8AGR4EJF,"January 29, 2020",Teresa (ohio),Unverified,1,MC3326adwe,N/A,0,0,No,Run!,https://www.amazon.com/gp/customer-reviews/R1ZJ5A8AGR4EJF?ie=UTF8&ASIN=B07T5PRRXD,,"This printer is nothing but trouble. It is not user friendly. Our tech provider, along with certified Lexmark techs and I have spent countless man hours trying to get this printer to work correctly and have gotten nowhere. The airprint still doesn't work...at all...and the scanning feature is not working either. I would advise anyone considering purchasing this Lexmark to save your money and look elsewhere. I am so disappointed. Beyond that, I would also add that after yet another 2 hour telephone call to Lexmark yesterday, I have yet to receive the promised return communication from a more advanced tech. Lexmark? Really? You can do better. If there were lemon laws for printers, this one would definitely qualify as a lemon."
RQ267Y8YK5H6I,"January 20, 2020",Amazon Customer,Vine Customer,5,MC3326adwe,N/A,0,0,No,This is now my main printer,https://www.amazon.com/gp/customer-reviews/RQ267Y8YK5H6I?ie=UTF8&ASIN=B07T5PRRXD,,I have owned dozens of printers and this is the one I have chosen as my constantly on home printer. Anything other than photos are printed on this printer. Not that it does not print a decent photo but I have a much more expensive professional printer just for photos. I like everything about this printer and it is my current top choice for a home printer. It is dependable and as long as I keep paper in it I can count on it to print whatever I send to it. An absolute recommendation.
R2ZQGVP8POFMXU,"January 18, 2020",lynda,Verified Purchase,1,MC3326adwe,N/A,0,1,No,THIS PRINTER IS A PIECE OF CRAP!!!!,https://www.amazon.com/gp/customer-reviews/R2ZQGVP8POFMXU?ie=UTF8&ASIN=B07T5PRRXD,,"this is the worst printer i have ever bought- hard to get the paper in, hard to get it to print- the worst piece of crap everand i just bought new cartriges(very expensive) and it says ink supply low when it should be fullgoing back to HP"
RVP7XWF4RBIQ4,"January 7, 2020",H. Erickson,Vine Customer,5,MC3326adwe,N/A,0,0,No,"An excellent laser printer, especially for crafting!",https://www.amazon.com/gp/customer-reviews/RVP7XWF4RBIQ4?ie=UTF8&ASIN=B07T5PRRXD,,"This has been an excellent laser printer so far! We are incredibly pleased with it. Since it arrived and we set it up--which was simple for my husband but he is an IT guy so consider that--we've used it a ton. Probably a good two reams of paper and we've been satisfied with it all.It is an incredibly quick printer and scanner. The print quality is great and the ink never bleeds. I've enjoyed using this printer with my crafts, specifically my waterslide decals, because the laser ink doesn't need to be sealed and doesn't bleed under moisture. It dries quickly and applies precisely.Scanning setup took a bit more effort for me (husband wasn't home) but I got it up and running just fine by myself. The menu is color and so far has worked well, I have no problem operating this printer at all. My multiple devices have paired with it great.As far as laser printers go, and this one also being a color printer, this is an excellent choice for a home or small business printer! I would absolutely recommend it without reservations at this point. Of course, if anything changes I'll update this review accordingly."
R1FT7XLJFWCNHR,"December 5, 2019",Marc Murphy,Verified Purchase,5,MC3326adwe,N/A,2,0,No,Great MFP with amazing advanced network security settings,https://www.amazon.com/gp/customer-reviews/R1FT7XLJFWCNHR?ie=UTF8&ASIN=B07T5PRRXD,,The Web Interface for this printer is unlike anything I have ever seen and I'm in this industry. It comes with a small business price tag.......but has enterprise class features and performance. Great Product!
R1Q32ICX39T0Z6,"November 6, 2019",tjkindle,Verified Purchase,1,MC3326adwe,N/A,5,0,No,nightmare,https://www.amazon.com/gp/customer-reviews/R1Q32ICX39T0Z6?ie=UTF8&ASIN=B07T5PRRXD,,Nightmare to try an attempt wireless hook up for printing . spent hours on phone with support to no avail.I would recommend to Lexmark to enclose better instructions or don't buy
R26MNIOGAQK1A7,"October 29, 2019",bringles,Verified Purchase,1,MC3326adwe,N/A,11,1,No,"TONER IS OVER $100 PER COLOR, STAY AWAY",https://www.amazon.com/gp/customer-reviews/R26MNIOGAQK1A7?ie=UTF8&ASIN=B07T5PRRXD,,"BEWARE, TONER IS OVER $100 FOR EACH COLOR, STAY AWAY"
R2QL9XVWH70BIX,"October 15, 2019",subu mysore,Verified Purchase,5,MC3326adwe,N/A,0,0,No,Works well for me,https://www.amazon.com/gp/customer-reviews/R2QL9XVWH70BIX?ie=UTF8&ASIN=B07T5PRRXD,,It is silent. It is fast. It is too early to state Maintenance and any issues of long term usage
R2C92Z8Y9ULGHZ,"March 27, 2020",Amazon Customer,Verified Purchase,3,MC3224dwe,N/A,0,0,No,No way to Scan to Computer,https://www.amazon.com/gp/customer-reviews/R2C92Z8Y9ULGHZ?ie=UTF8&ASIN=B07T1DQNNS,,"""Scan Profiles"" not available."
R3I4D7WN7XZJ95,"March 19, 2020",Animal Friendly,Verified Purchase,5,MC3224dwe,N/A,0,0,No,Good quality build and finish and Win10 sees it easily.,https://www.amazon.com/gp/customer-reviews/R3I4D7WN7XZJ95?ie=UTF8&ASIN=B07T1DQNNS,,"A great looking printer. Solid and comes with toner. Prints nice like a laser should, and win10 computers see it easily.One note on setup, skip the ""lexmark app"" and just setup from the touchscreen on the printer, it connects to the network and is easy to use from nearby computers. I'm very satisfied once I abandoned the setup QR code and app nonsense. Also don't bother with the included CD."
R1THLTVFM0X4PU,"March 16, 2020",Peterc0527,Verified Purchase,5,MC3224dwe,N/A,0,0,No,"Easy setup, good features",https://www.amazon.com/gp/customer-reviews/R1THLTVFM0X4PU?ie=UTF8&ASIN=B07T1DQNNS,,"We are very low-volume printers. The Lexmark was easy to set up, works well. The apps that go with it (especially Mopria) make printing from tablets and phones easy. There's a Lexmark Scan app that sends the scan to your device instead of requiring a USB drive. My only issue so far is the cost of toner. It's almost as bad as ink-jets. But, the initial toner supply has already lasted quite a while, although we only print a page or two a day."
R2KZ00022SBTIG,"March 3, 2020",Laudel,Verified Purchase,5,MC3224dwe,N/A,0,1,No,Bye Bye Ink!,https://www.amazon.com/gp/customer-reviews/R2KZ00022SBTIG?ie=UTF8&ASIN=B07T1DQNNS,,"If you still have an inkjet printer, stop reading this review, throw it out, and continue reading this when you are done. No more dried up ink cartridges when I used them once. No more time wasted trying nozzle cleaning and head alignment trying to get it to print right. I don't print very often but when I do, I want it to work right the first time without wasting my time. This printer just wakes up and prints with great quality every time."
R1IT939HU05BWH,"February 25, 2020",Enrique A Falcon,Verified Purchase,3,MC3224dwe,N/A,0,1,No,THE INSTALLATION SOFTWARE IS INADEQUATE,https://www.amazon.com/gp/customer-reviews/R1IT939HU05BWH?ie=UTF8&ASIN=B07T1DQNNS,,I bought the printer because of the high quality I got from other printers from Lexmark.The printer itself is excellent. But the installation software is a disaster.The software needed to scan is even worse. I cannot believe a company like Lexmark (IBM) allows this fiasco out in the market.
R1EL7QAMANV6BC,"February 21, 2020",Clement Bence,Verified Purchase,1,MC3224dwe,N/A,0,1,No,No impressed,https://www.amazon.com/gp/customer-reviews/R1EL7QAMANV6BC?ie=UTF8&ASIN=B07T1DQNNS,,I have purchased multiple multi function machines. The software for scanning is really poor compared to HPs that i have used. Complicated and not very user friendly. The first few times i printed the quality wasn't good and it jammed 3 times before working. I would not recommend this printer.
R2YLBSDYV7G3HR,"February 2, 2020",tazzdevil,Verified Purchase,2,MC3224dwe,N/A,0,1,No,Duplex printing was a desaster,https://www.amazon.com/gp/customer-reviews/R2YLBSDYV7G3HR?ie=UTF8&ASIN=B07T1DQNNS,,"The printer setup was a breeze, but the operation fell down when I tried to print double sided. Paper jammed every time I tried to print. An hour plus on the phone was a waste of time as the help lines were useless and did not know how to fix this problem. I am getting a replacement from Amazon so am hoping it works out better. My question is why is it so hard to make a printer that works out of the box?"
R2RKRSTKLWSG8,"January 26, 2020",James Rumberger,Verified Purchase,1,MC3224dwe,N/A,0,1,No,Junk,https://www.amazon.com/gp/customer-reviews/R2RKRSTKLWSG8?ie=UTF8&ASIN=B07T1DQNNS,,Junk does not work wirelessly. So I couldn't print nothing. Do Not buy
R1UAXZ8GZ3SW75,"January 5, 2020",Laurie VanderPloeg,Verified Purchase,5,MC3224dwe,N/A,1,0,No,Great printer,https://www.amazon.com/gp/customer-reviews/R1UAXZ8GZ3SW75?ie=UTF8&ASIN=B07T1DQNNS,,Easy to set up and it works well
R1UQPAQXZO37YD,"December 25, 2019",VinodKumarKp,Vine Customer,3,MC3224dwe,N/A,0,0,No,Costly toner,https://www.amazon.com/gp/customer-reviews/R1UQPAQXZO37YD?ie=UTF8&ASIN=B07T1DQNNS,,"Easy to setup, simply follow the onscreen instructions. Printer is multipurpose with ability to print on both sides, scanning, wireless printing. Prints very fast (Better than my current printer which takes close to 30 seconds to print).Using for it past few months to print personal as well as office related work, so far no issues. The machine came with starter toner with very less ink. Toners are pretty expensive for this printer, costing me close to $75 for each toner.Overall, printer with lot of features but costly toners."
R21CCFM7YSP56N,"March 17, 2020",Jonathan Church,Verified Purchase,1,MB2236adwe,N/A,0,0,No,Terrible,https://www.amazon.com/gp/customer-reviews/R21CCFM7YSP56N?ie=UTF8&ASIN=B07T3HB1VZ,,"Slow as molasses, and then it stopped printing altogether."
RBUXGMDN6YGTX,"March 16, 2020",Frank funaro,Verified Purchase,5,MB2236adwe,N/A,0,0,No,works!,https://www.amazon.com/gp/customer-reviews/RBUXGMDN6YGTX?ie=UTF8&ASIN=B07T3HB1VZ,,"you guys replaced it in a hurry as i wished, it came just like you said, and worked perfectly, i thank you!"
R308K94GIV24YN,"March 14, 2020",Norville Ruland,Verified Purchase,5,MB2236adwe,N/A,1,1,No,very good quality.,https://www.amazon.com/gp/customer-reviews/R308K94GIV24YN?ie=UTF8&ASIN=B07T3HB1VZ,,Was easy to install when I got the right driver. Bought for my mom and here computer is a vista operating system. downloaded the correct driver and worked great. I sell the BSD line of Lexmark and love them. the best for business you can get. The toner return policy is great. I ordered extra toner for this printer and got it the next day.
R3LM2B3Q2I7A8E,"March 11, 2020",LarryN,Verified Purchase,3,MB2236adwe,N/A,0,0,No,over all a B+.,https://www.amazon.com/gp/customer-reviews/R3LM2B3Q2I7A8E?ie=UTF8&ASIN=B07T3HB1VZ,,Does not print envelopes well. wrinkles as envelopes go through the process
R3HA9DR8D3GJ3O,"March 2, 2020",Steve,Verified Purchase,5,MB2236adwe,N/A,0,0,No,Good printer for the price,https://www.amazon.com/gp/customer-reviews/R3HA9DR8D3GJ3O?ie=UTF8&ASIN=B07T3HB1VZ,,This product is quite satisfactory for the price. It does the job and was not overpriced.
R2YSFY28RFE0AU,"February 17, 2020",Yaritza,Verified Purchase,5,MB2236adwe,N/A,0,0,No,Very good,https://www.amazon.com/gp/customer-reviews/R2YSFY28RFE0AU?ie=UTF8&ASIN=B07T3HB1VZ,,Very good product
R25LJ6YTOSYIZH,"February 7, 2020",DJAnderson,Verified Purchase,5,MB2236adwe,N/A,1,0,No,GREAT WIRELESS NETWORK PRINTER,https://www.amazon.com/gp/customer-reviews/R25LJ6YTOSYIZH?ie=UTF8&ASIN=B07T3HB1VZ,,Great wireless network printer - a real work horse!!! Couldn't be happier
R3KUMEIZPC2UEV,"January 31, 2020",Amazon Customer,Verified Purchase,1,MB2236adwe,N/A,0,0,No,Scanning doesnâ€™t work,https://www.amazon.com/gp/customer-reviews/R3KUMEIZPC2UEV?ie=UTF8&ASIN=B07T3HB1VZ,,Doesnâ€™t scan to email correctly
R3CCUT4MYS1FQ5,"January 14, 2020",Alden L Baxter,Verified Purchase,5,MB2236adwe,N/A,0,0,No,Setup via mobile phone was difficult,https://www.amazon.com/gp/customer-reviews/R3CCUT4MYS1FQ5?ie=UTF8&ASIN=B07T3HB1VZ,,Initial set up was challenging. Once done the connection is perfect
